,index,utter_1,utter_2
0,651,"Mrs Bennet was perfectly satisfied, and quitted the house under the       delightful persuasion that, allowing for the necessary preparations of       settlements, new carriages, and wedding clothes, she should undoubtedly       see her daughter settled at Netherfield in the course of three or four       months. Of having another daughter married to Mr Collins, she thought       with equal certainty, and with considerable, though not equal, pleasure.       Elizabeth was the least dear to her of all her children; and though the       man and the match were quite good enough for her, the worth of each       was eclipsed by Mr Bingley and Netherfield.",Chapter 19
1,652,Chapter 19,"The next day opened a new scene at Longbourn. Mr Collins made his       declaration in form. Having resolved to do it without loss of time, as his       leave of absence extended only to the following Saturday, and having no       feelings of diffidence to make it distressing to himslf even at the       moment, he set about it in a very orderly manner, with all the       observances, which he supposed a regular part of the business. On finding       Mrs Bennet, Elizabeth, and one of the younger girls together, soon after       breakfast, he addressed the mother in these words:"
2,653,"The next day opened a new scene at Longbourn. Mr Collins made his       declaration in form. Having resolved to do it without loss of time, as his       leave of absence extended only to the following Saturday, and having no       feelings of diffidence to make it distressing to himslf even at the       moment, he set about it in a very orderly manner, with all the       observances, which he supposed a regular part of the business. On finding       Mrs Bennet, Elizabeth, and one of the younger girls together, soon after       breakfast, he addressed the mother in these words:","""May I hope, madam, for your interest with your fair daughter Elizabeth,       when I solicit for the honour of a private audience with her in the course       of this morning?"""
3,654,"""May I hope, madam, for your interest with your fair daughter Elizabeth,       when I solicit for the honour of a private audience with her in the course       of this morning?""","Before Elizabeth had time for anything but a blush of surprise, Mrs       Bennet answered instantly, "
4,655,"Before Elizabeth had time for anything but a blush of surprise, Mrs       Bennet answered instantly, ","""Dear madam, do not go. I beg you will not go. Mr Collins must excuse me.       He can have nothing to say to me that anybody need not hear. I am going       away myself."""
5,656,"""Dear madam, do not go. I beg you will not go. Mr Collins must excuse me.       He can have nothing to say to me that anybody need not hear. I am going       away myself.""","""No, no, nonsense, Lizzy. I desire you to stay where you are."""
6,657,"""No, no, nonsense, Lizzy. I desire you to stay where you are.""","Elizabeth would not oppose such an injunction—and a moment's       consideration making her also sensible that it would be wisest to get it       over as soon and as quietly as possible, she sat down again and tried to       conceal, by incessant employment the feelings which were divided between       distress and diversion. Mrs Bennet and Kitty walked off, and as soon as       they were gone, Mr Collins began."
7,658,"Elizabeth would not oppose such an injunction—and a moment's       consideration making her also sensible that it would be wisest to get it       over as soon and as quietly as possible, she sat down again and tried to       conceal, by incessant employment the feelings which were divided between       distress and diversion. Mrs Bennet and Kitty walked off, and as soon as       they were gone, Mr Collins began.","""Believe me, my dear MissElizabeth, that your modesty, so far from doing       you any disservice, rather adds to your other perfections. You would have       been less amiable in my eyes had there not been this little       unwillingness; but allow me to assure you, that I have your respected       mother's permisson for this address. You can hardly doubt the purport of       my discourse, however your natural delicacy may lead you to dissemble; my       attentions have been too marked to be mistaken. Almost as soon as I       entered the house, I singled you out as the companion of my future life.       But before I am run away with by my feelings on this subject, perhaps it       would be advisable for me to state my reasons for marrying—and,       moreover, for coming into Hertfordshire with the design of selecting a       wife, as I certainly did."""
8,659,"""Believe me, my dear MissElizabeth, that your modesty, so far from doing       you any disservice, rather adds to your other perfections. You would have       been less amiable in my eyes had there not been this little       unwillingness; but allow me to assure you, that I have your respected       mother's permisson for this address. You can hardly doubt the purport of       my discourse, however your natural delicacy may lead you to dissemble; my       attentions have been too marked to be mistaken. Almost as soon as I       entered the house, I singled you out as the companion of my future life.       But before I am run away with by my feelings on this subject, perhaps it       would be advisable for me to state my reasons for marrying—and,       moreover, for coming into Hertfordshire with the design of selecting a       wife, as I certainly did.""","The idea of Mr Collins, with all his solemn composure, being run away       with by his feelings, made Elizabeth so near laughing, that she could not       use the short pause he allowed in any attempt to stop him further, and he       continued:"
9,660,"The idea of Mr Collins, with all his solemn composure, being run away       with by his feelings, made Elizabeth so near laughing, that she could not       use the short pause he allowed in any attempt to stop him further, and he       continued:","""My reasons for marrying are, first, that I think it a right thing for       every clergyman in easy circumsances (like myself) to set the example of       matrimony in his parish; secondly, that I am convinced that it will add       very greatly to my happiness; and thirdly—which perhaps I ought to       have mentioned earlier, that it is the particular advice and       recommendation of the very noble lady whom I have the honour of calling       patroness. Twice has she condescended to give me her opinion (unasked       too!) on this subject; and it was but the very Saturday night before I       left Hunsford—between our pools at quadrille, while Mrs Jenkinson       was arranging Missde Bourgh's footstool, that she said, 'Mr Collins, you       must marry. A clergyman like you must marry. Choose properly, choose a       gentlewoman for my sake; and for your own, let her be an       active, useful sort of person, not brought up high, but able to make a       small income go a good way. This is my advice. Find such a woman as soon       as you can, bring her to Hunsford, and I will visit her.' Allow me, by the       way, to observe, my fair cousin, that I do not reckon the notice and       kindness of Lady Catherine de Bourgh as among the least of the advantages       in my power to offer. You will find her manners beyond anything I can       describe; and your wit and vivacity, I think, must be acceptable to her,       especially when tempered with the silence and respect which her rank will       inevitably excite. Thus much for my general intention in favour of       matrimony; it remains to be told why my views were directed towards       Longbourn instead of my own neighbourhood, where I can assure you there       are many amiable young women. But the fact is, that being, as I am, to       inherit this estate after the death of your honoured father (who, however,       may live many years longer), I could not satisfy myself without resolving       to choose a wife from among his daughters, that the loss to them might be       as little as possible, when the melancholy event takes place—which,       however, as I have already said, may not be for several years. This has       been my motive, my fair cousin, and I flatter myself it will not sink me       in your esteem. And now nothing remains for me but to assure you in the       most animated language of the violence of my affection. To fortune I am       perfectly indifferent, and shall make no demand of that nature on your       father, since I am well aware that it could not be complied with; and that       one thousand pounds in the four per cents, which will not be yours till       after your mother's decease, is all that you may ever be entitled to. On       that head, therefore, I shall be uniformly silent; and you may assure       yourself that no ungenerous reproach shall ever pass my lips when we are       married."""
10,661,"""My reasons for marrying are, first, that I think it a right thing for       every clergyman in easy circumsances (like myself) to set the example of       matrimony in his parish; secondly, that I am convinced that it will add       very greatly to my happiness; and thirdly—which perhaps I ought to       have mentioned earlier, that it is the particular advice and       recommendation of the very noble lady whom I have the honour of calling       patroness. Twice has she condescended to give me her opinion (unasked       too!) on this subject; and it was but the very Saturday night before I       left Hunsford—between our pools at quadrille, while Mrs Jenkinson       was arranging Missde Bourgh's footstool, that she said, 'Mr Collins, you       must marry. A clergyman like you must marry. Choose properly, choose a       gentlewoman for my sake; and for your own, let her be an       active, useful sort of person, not brought up high, but able to make a       small income go a good way. This is my advice. Find such a woman as soon       as you can, bring her to Hunsford, and I will visit her.' Allow me, by the       way, to observe, my fair cousin, that I do not reckon the notice and       kindness of Lady Catherine de Bourgh as among the least of the advantages       in my power to offer. You will find her manners beyond anything I can       describe; and your wit and vivacity, I think, must be acceptable to her,       especially when tempered with the silence and respect which her rank will       inevitably excite. Thus much for my general intention in favour of       matrimony; it remains to be told why my views were directed towards       Longbourn instead of my own neighbourhood, where I can assure you there       are many amiable young women. But the fact is, that being, as I am, to       inherit this estate after the death of your honoured father (who, however,       may live many years longer), I could not satisfy myself without resolving       to choose a wife from among his daughters, that the loss to them might be       as little as possible, when the melancholy event takes place—which,       however, as I have already said, may not be for several years. This has       been my motive, my fair cousin, and I flatter myself it will not sink me       in your esteem. And now nothing remains for me but to assure you in the       most animated language of the violence of my affection. To fortune I am       perfectly indifferent, and shall make no demand of that nature on your       father, since I am well aware that it could not be complied with; and that       one thousand pounds in the four per cents, which will not be yours till       after your mother's decease, is all that you may ever be entitled to. On       that head, therefore, I shall be uniformly silent; and you may assure       yourself that no ungenerous reproach shall ever pass my lips when we are       married.""",It was absolutely necessary to interrupt him now.
11,662,It was absolutely necessary to interrupt him now.,"""You are too hasty, sir,"""
12,663,"""You are too hasty, sir,""","""I am not now to learn,"""
13,664,"""I am not now to learn,""","""Upon my word, sir,"""
14,665,"""Upon my word, sir,""","""Were it certain that Lady Catherine would think so,"""
15,666,"""Were it certain that Lady Catherine would think so,""","""Indeed, Mr Collins, all praise of me will be unnecessary. You must give       me leave to judge for myself, and pay me the compliment of believing what       I say. I wish you very happy and very rich, and by refusing your hand, do       all in my power to prevent your being otherwise. In making me the offer,       you must have satisfied the delicacy of your feelings with regard to my       family, and may take possession of Longbourn estate whenever it falls,       without any self-reproach. This matter may be considered, therefore, as       finally settled."""
16,667,"""Indeed, Mr Collins, all praise of me will be unnecessary. You must give       me leave to judge for myself, and pay me the compliment of believing what       I say. I wish you very happy and very rich, and by refusing your hand, do       all in my power to prevent your being otherwise. In making me the offer,       you must have satisfied the delicacy of your feelings with regard to my       family, and may take possession of Longbourn estate whenever it falls,       without any self-reproach. This matter may be considered, therefore, as       finally settled.""","""When I do myself the honour of speaking to you next on the subject, I       shall hope to receive a more favourable answer than you have now given me;       though I am far from accusing you of cruelty at present, because I know it       to be the established custom of your sex to reject a man on the first       application, and perhaps you have even now said as much to encourage my       suit as would be consistent with the true delicacy of the female       character."""
17,668,"""When I do myself the honour of speaking to you next on the subject, I       shall hope to receive a more favourable answer than you have now given me;       though I am far from accusing you of cruelty at present, because I know it       to be the established custom of your sex to reject a man on the first       application, and perhaps you have even now said as much to encourage my       suit as would be consistent with the true delicacy of the female       character.""","""Really, Mr Collins,"""
18,669,"""Really, Mr Collins,""","""You must give me leave to flatter myself, my dear cousin, that your       refusal of my addresses is merely words of course. My reasons for       believing it are briefly these: It does not appear to me that my hand is       unworthy of your acceptance, or that the establishment I can offer would be       any other than highly desirable. My situation in life, my connections with       the family of de Bourgh, and my relationship to your own, are       circumsances highly in my favour; and you should take it into further       consideration, that in spite of your manifold attractions, it is by no       means certain that another offer of marriage may ever be made you. Your       portion is unhappily so small that it will in all likelihood undo the       effects of your loveliness and amiable qualifications. As I must therefore       conclude that you are not serious in your rejection of me, I shall choose       to attribute it to your wish of increasing my love by suspense, according       to the usual practice of elegant females."""
19,670,"""You must give me leave to flatter myself, my dear cousin, that your       refusal of my addresses is merely words of course. My reasons for       believing it are briefly these: It does not appear to me that my hand is       unworthy of your acceptance, or that the establishment I can offer would be       any other than highly desirable. My situation in life, my connections with       the family of de Bourgh, and my relationship to your own, are       circumsances highly in my favour; and you should take it into further       consideration, that in spite of your manifold attractions, it is by no       means certain that another offer of marriage may ever be made you. Your       portion is unhappily so small that it will in all likelihood undo the       effects of your loveliness and amiable qualifications. As I must therefore       conclude that you are not serious in your rejection of me, I shall choose       to attribute it to your wish of increasing my love by suspense, according       to the usual practice of elegant females.""","""I do assure you, sir, that I have no pretensions whatever to that kind of       elegance which consists in tormenting a respectable man. I would rather be       paid the compliment of being believed sincere. I thank you again and again       for the honour you have done me in your proposals, but to accept them is       absolutely impossible. My feelings in every respect forbid it. Can I speak       plainer? Do not consider me now as an elegant female, intending to plague       you, but as a rational creature, speaking the truth from her heart."""
20,671,"""I do assure you, sir, that I have no pretensions whatever to that kind of       elegance which consists in tormenting a respectable man. I would rather be       paid the compliment of being believed sincere. I thank you again and again       for the honour you have done me in your proposals, but to accept them is       absolutely impossible. My feelings in every respect forbid it. Can I speak       plainer? Do not consider me now as an elegant female, intending to plague       you, but as a rational creature, speaking the truth from her heart.""","""You are uniformly charming!"""
21,672,"""You are uniformly charming!""","To such perseverance in wilful self-deception Elizabeth would make no       reply, and immediately and in silence withdrew; determined, if he       persisted in considering her repeated refusals as flattering       encouragement, to apply to her father, whose negative might be uttered in       such a manner as to be decisive, and whose behaviour at least could not be       mistaken for the affectation and coquetry of an elegant female."
22,673,"To such perseverance in wilful self-deception Elizabeth would make no       reply, and immediately and in silence withdrew; determined, if he       persisted in considering her repeated refusals as flattering       encouragement, to apply to her father, whose negative might be uttered in       such a manner as to be decisive, and whose behaviour at least could not be       mistaken for the affectation and coquetry of an elegant female.",Chapter 20
23,674,Chapter 20,"Mr Collins was not left long to the silent contemplation of his       successful love; for Mrs Bennet, having dawdled about in the vestibule to       watch for the end of the conference, no sooner saw Elizabeth open the door       and with quick step pass her towards the staircase, than she entered the       breakfast-room, and congratulated both him and herself in warm termson       the happy prospect of their nearer connection. Mr Collins received and       returned these felicitations with equal pleasure, and then proceeded to       relate the particulars of their interview, with the result of which he       trusted he had every reason to be satisfied, since the refusal which his       cousin had steadfastly given him would naturally flow from her bashful       modesty and the genuine delicacy of her character."
24,675,"Mr Collins was not left long to the silent contemplation of his       successful love; for Mrs Bennet, having dawdled about in the vestibule to       watch for the end of the conference, no sooner saw Elizabeth open the door       and with quick step pass her towards the staircase, than she entered the       breakfast-room, and congratulated both him and herself in warm termson       the happy prospect of their nearer connection. Mr Collins received and       returned these felicitations with equal pleasure, and then proceeded to       relate the particulars of their interview, with the result of which he       trusted he had every reason to be satisfied, since the refusal which his       cousin had steadfastly given him would naturally flow from her bashful       modesty and the genuine delicacy of her character.","This information, however, startled Mrs Bennet; she would have been glad       to be equally satisfied that her daughter had meant to encourage him by       protesting against his proposals, but she dared not believe it, and could       not help saying so."
25,676,"This information, however, startled Mrs Bennet; she would have been glad       to be equally satisfied that her daughter had meant to encourage him by       protesting against his proposals, but she dared not believe it, and could       not help saying so.","""But, depend upon it, Mr Collins,"""
26,677,"""But, depend upon it, Mr Collins,""","""Pardon me for interrupting you, madam,"""
27,678,"""Pardon me for interrupting you, madam,""","""Sir, you quite misunderstand me,"""
28,679,"""Sir, you quite misunderstand me,""","She would not give him time to reply, but hurrying instantly to her       husband, called out as she entered the library, "
29,680,"She would not give him time to reply, but hurrying instantly to her       husband, called out as she entered the library, ","Mr Bennet raised his eyes from his book as she entered, and fixed them on       her face with a calm unconcern which was not in the least altered by her       communication."
30,681,"Mr Bennet raised his eyes from his book as she entered, and fixed them on       her face with a calm unconcern which was not in the least altered by her       communication.","""I have not the pleasure of understanding you,"""
31,682,"""I have not the pleasure of understanding you,""","""Of Mr Collins and Lizzy. Lizzy declares she will not have Mr Collins,       and Mr Collins begins to say that he will not have Lizzy."""
32,683,"""Of Mr Collins and Lizzy. Lizzy declares she will not have Mr Collins,       and Mr Collins begins to say that he will not have Lizzy.""","""And what am I to do on the occasion? It seemsan hopeless business."""
33,684,"""And what am I to do on the occasion? It seemsan hopeless business.""","""Speak to Lizzy about it yourself. Tell her that you insist upon her       marrying him."""
34,685,"""Speak to Lizzy about it yourself. Tell her that you insist upon her       marrying him.""","""Let her be called down. She shall hear my opinion."""
35,686,"""Let her be called down. She shall hear my opinion.""","Mrs Bennet rang the bell, and MissElizabeth was summoned to the library."
36,687,"Mrs Bennet rang the bell, and MissElizabeth was summoned to the library.","""Come here, child,"""
37,688,"""Come here, child,""","""I have, sir."""
38,689,"""I have, sir.""","""Very well. We now come to the point. Your mother insists upon your       accepting it. Is it not so, Mrs Bennet?"""
39,690,"""Very well. We now come to the point. Your mother insists upon your       accepting it. Is it not so, Mrs Bennet?""","""Yes, or I will never see her again."""
40,691,"""Yes, or I will never see her again.""","""An unhappy alternative is before you, Elizabeth. From this day you must       be a stranger to one of your parents. Your mother will never see you again       if you do not marry Mr Collins, and I will never see you again if       you do."""
41,692,"""An unhappy alternative is before you, Elizabeth. From this day you must       be a stranger to one of your parents. Your mother will never see you again       if you do not marry Mr Collins, and I will never see you again if       you do.""","Elizabeth could not but smile at such a conclusion of such a beginning,       but Mrs Bennet, who had persuaded herself that her husband regarded the       affair as she wished, was excessively disappointed."
42,693,"Elizabeth could not but smile at such a conclusion of such a beginning,       but Mrs Bennet, who had persuaded herself that her husband regarded the       affair as she wished, was excessively disappointed.","""What do you mean, Mr Bennet, in talking this way? You promised me to insist       upon her marrying him."""
43,694,"""What do you mean, Mr Bennet, in talking this way? You promised me to insist       upon her marrying him.""","""My dear,"""
44,695,"""My dear,""","Not yet, however, in spite of her disappointment in her husband, did Mrs       Bennet give up the point. She talked to Elizabeth again and again; coaxed       and threatened her by turns. She endeavoured to secure Jane in her       interest; but Jane, with all possible mildness, declined interfering; and       Elizabeth, sometimes with real earnestness, and sometimes with playful       gaiety, replied to her attacks. Though her manner varied, however, her       determination never did."
45,696,"Not yet, however, in spite of her disappointment in her husband, did Mrs       Bennet give up the point. She talked to Elizabeth again and again; coaxed       and threatened her by turns. She endeavoured to secure Jane in her       interest; but Jane, with all possible mildness, declined interfering; and       Elizabeth, sometimes with real earnestness, and sometimes with playful       gaiety, replied to her attacks. Though her manner varied, however, her       determination never did.","Mr Collins, meanwhile, was meditating in solitude on what had passed. He       thought too well of himslf to comprehend on what motives his cousin could       refuse him; and though his pride was hurt, he suffered in no other way.       His regard for her was quite imaginary; and the possibility of her       deserving her mother's reproach prevented his feeling any regret."
