,index,utter_1,utter_2
46,697,"Mr Collins, meanwhile, was meditating in solitude on what had passed. He       thought too well of himslf to comprehend on what motives his cousin could       refuse him; and though his pride was hurt, he suffered in no other way.       His regard for her was quite imaginary; and the possibility of her       deserving her mother's reproach prevented his feeling any regret.","While the family were in this confusion, Charlotte Lucas came to spend the       day with them. She was met in the vestibule by Lydia, who, flying to her,       cried in a half whisper, "
47,698,"While the family were in this confusion, Charlotte Lucas came to spend the       day with them. She was met in the vestibule by Lydia, who, flying to her,       cried in a half whisper, ","Charlotte hardly had time to answer, before they were joined by Kitty, who       came to tell the same news; and no sooner had they entered the       breakfast-room, where Mrs Bennet was alone, than she likewise began on       the subject, calling on MissLucas for her compassion, and entreating her       to persuade her friend Lizzy to comply with the wishes of all her family.       "
48,699,"Charlotte hardly had time to answer, before they were joined by Kitty, who       came to tell the same news; and no sooner had they entered the       breakfast-room, where Mrs Bennet was alone, than she likewise began on       the subject, calling on MissLucas for her compassion, and entreating her       to persuade her friend Lizzy to comply with the wishes of all her family.       ",Charlotte's reply was spared by the entrance of Jane and Elizabeth.
49,700,Charlotte's reply was spared by the entrance of Jane and Elizabeth.,"""Aye, there she comes,"""
50,701,"""Aye, there she comes,""","Her daughters listened in silence to this effusion, sensible that any       attempt to reason with her or soothe her would only increase the       irritation. She talked on, therefore, without interruption from any of       them, till they were joined by Mr Collins, who entered the room with an       air more stately than usual, and on perceiving whom, she said to the       girls, "
51,702,"Her daughters listened in silence to this effusion, sensible that any       attempt to reason with her or soothe her would only increase the       irritation. She talked on, therefore, without interruption from any of       them, till they were joined by Mr Collins, who entered the room with an       air more stately than usual, and on perceiving whom, she said to the       girls, ","Elizabeth passed quietly out of the room, Jane and Kitty followed, but       Lydia stood her ground, determined to hear all she could; and Charlotte,       detained first by the civility of Mr Collins, whose inquiries after       herself and all her family were very minute, and then by a little       curiosity, satisfied herself with walking to the window and pretending not       to hear. In a doleful voice Mrs Bennet began the projected conversation:       "
52,703,"Elizabeth passed quietly out of the room, Jane and Kitty followed, but       Lydia stood her ground, determined to hear all she could; and Charlotte,       detained first by the civility of Mr Collins, whose inquiries after       herself and all her family were very minute, and then by a little       curiosity, satisfied herself with walking to the window and pretending not       to hear. In a doleful voice Mrs Bennet began the projected conversation:       ","""My dear madam,"""
53,704,"""My dear madam,""",Chapter 21
54,705,Chapter 21,"The discussion of Mr Collins's offer was now nearly at an end, and       Elizabeth had only to suffer from the uncomfortable feelings necessarily       attending it, and occasionally from some peevish allusions of her mother.       As for the gentleman himslf, his feelings were chiefly expressed,       not by embarrassment or dejection, or by trying to avoid her, but by       stiffness of manner and resentful silence. He scarcely ever spoke to her,       and the assiduous attentions which he had been so sensible of himslf were       transferred for the rest of the day to MissLucas, whose civility in       listening to him was a seasonable relief to them all, and especially to       her friend."
55,706,"The discussion of Mr Collins's offer was now nearly at an end, and       Elizabeth had only to suffer from the uncomfortable feelings necessarily       attending it, and occasionally from some peevish allusions of her mother.       As for the gentleman himslf, his feelings were chiefly expressed,       not by embarrassment or dejection, or by trying to avoid her, but by       stiffness of manner and resentful silence. He scarcely ever spoke to her,       and the assiduous attentions which he had been so sensible of himslf were       transferred for the rest of the day to MissLucas, whose civility in       listening to him was a seasonable relief to them all, and especially to       her friend.","The morrow produced no abatement of Mrs Bennet's ill-humour or ill       health. Mr Collins was also in the same state of angry pride. Elizabeth       had hoped that his resentment might shorten his visit, but his plan did       not appear in the least affected by it. He was always to have gone on       Saturday, and to Saturday he meant to stay."
56,707,"The morrow produced no abatement of Mrs Bennet's ill-humour or ill       health. Mr Collins was also in the same state of angry pride. Elizabeth       had hoped that his resentment might shorten his visit, but his plan did       not appear in the least affected by it. He was always to have gone on       Saturday, and to Saturday he meant to stay.","After breakfast, the girls walked to Meryton to inquire if Mr Wickham       were returned, and to lament over his absence from the Netherfield ball.       He joined them on their entering the town, and attended them to their       aunt's where his regret and vexation, and the concern of everybody, was       well talked over. To Elizabeth, however, he voluntarily acknowledged that       the necessity of his absence had been self-imposed."
57,708,"After breakfast, the girls walked to Meryton to inquire if Mr Wickham       were returned, and to lament over his absence from the Netherfield ball.       He joined them on their entering the town, and attended them to their       aunt's where his regret and vexation, and the concern of everybody, was       well talked over. To Elizabeth, however, he voluntarily acknowledged that       the necessity of his absence had been self-imposed.","""I found,"""
58,709,"""I found,""","She highly approved his forbearance, and they had leisure for a full       discussion of it, and for all the commendation which they civilly bestowed       on each other, as Wickham and another officer walked back with them to       Longbourn, and during the walk he particularly attended to her. His       accompanying them was a double advantage; she felt all the compliment it       offered to herself, and it was most acceptable as an occasion of       introducing him to her father and mother."
59,710,"She highly approved his forbearance, and they had leisure for a full       discussion of it, and for all the commendation which they civilly bestowed       on each other, as Wickham and another officer walked back with them to       Longbourn, and during the walk he particularly attended to her. His       accompanying them was a double advantage; she felt all the compliment it       offered to herself, and it was most acceptable as an occasion of       introducing him to her father and mother.","Soon after their return, a letter was delivered to MissBennet; it came       from Netherfield. The envelope contained a sheet of elegant, little,       hot-pressed paper, well covered with a lady's fair, flowing hand; and       Elizabeth saw her sister's countenance change as she read it, and saw her       dwelling intently on some particular passages. Jane recollected herself       soon, and putting the letter away, tried to join with her usual       cheerfulness in the general conversation; but Elizabeth felt an anxiety on       the subject which drew off her attention even from Wickham; and no sooner       had he and his companion taken leave, than a glance from Jane invited her       to follow her up stairs. When they had gained their own room, Jane, taking       out the letter, said:"
60,711,"Soon after their return, a letter was delivered to MissBennet; it came       from Netherfield. The envelope contained a sheet of elegant, little,       hot-pressed paper, well covered with a lady's fair, flowing hand; and       Elizabeth saw her sister's countenance change as she read it, and saw her       dwelling intently on some particular passages. Jane recollected herself       soon, and putting the letter away, tried to join with her usual       cheerfulness in the general conversation; but Elizabeth felt an anxiety on       the subject which drew off her attention even from Wickham; and no sooner       had he and his companion taken leave, than a glance from Jane invited her       to follow her up stairs. When they had gained their own room, Jane, taking       out the letter, said:","""This is from Caroline Bingley; what it contains has surprised me a good       deal. The whole party have left Netherfield by this time, and are on their       way to town—and without any intention of coming back again. You       shall hear what she says."""
61,712,"""This is from Caroline Bingley; what it contains has surprised me a good       deal. The whole party have left Netherfield by this time, and are on their       way to town—and without any intention of coming back again. You       shall hear what she says.""","She then read the first sentence aloud, which comprised the information of       their having just resolved to follow their brother to town directly, and       of their meaning to dine in Grosvenor Street, where Mr Hurst had a house.       The next was in these words: "
62,713,"She then read the first sentence aloud, which comprised the information of       their having just resolved to follow their brother to town directly, and       of their meaning to dine in Grosvenor Street, where Mr Hurst had a house.       The next was in these words: ","""It is unlucky,"""
63,714,"""It is unlucky,""","""Caroline decidedly says that none of the party will return into       Hertfordshire this winter. I will read it to you:"""
64,715,"""Caroline decidedly says that none of the party will return into       Hertfordshire this winter. I will read it to you:""","""When my brother left us yesterday, he imagined that the business which       took him to London might be concluded in three or four days; but as we are       certain it cannot be so, and at the same time convinced that when Charles       gets to town he will be in no hurry to leave it again, we have determined       on following him thither, that he may not be obliged to spend his vacant       hours in a comfortless hotel. Many of my acquaintances are already there       for the winter; I wish that I could hear that you, my dearest friend, had       any intention of making one of the crowd—but of that I despair. I       sincerely hope your Christmas in Hertfordshire may abound in the gaieties       which that season generally brings, and that your beaux will be so       numerous as to prevent your feeling the loss of the three of whom we shall       deprive you."""
65,716,"""When my brother left us yesterday, he imagined that the business which       took him to London might be concluded in three or four days; but as we are       certain it cannot be so, and at the same time convinced that when Charles       gets to town he will be in no hurry to leave it again, we have determined       on following him thither, that he may not be obliged to spend his vacant       hours in a comfortless hotel. Many of my acquaintances are already there       for the winter; I wish that I could hear that you, my dearest friend, had       any intention of making one of the crowd—but of that I despair. I       sincerely hope your Christmas in Hertfordshire may abound in the gaieties       which that season generally brings, and that your beaux will be so       numerous as to prevent your feeling the loss of the three of whom we shall       deprive you.""","""It is evident by this,"""
66,717,"""It is evident by this,""","""It is only evident that MissBingley does not mean that he should."""
67,718,"""It is only evident that MissBingley does not mean that he should.""","""Why will you think so? It must be his own doing. He is his own master.       But you do not know all. I will read you the passage which       particularly hurts me. I will have no reserves from you."""
68,719,"""Why will you think so? It must be his own doing. He is his own master.       But you do not know all. I will read you the passage which       particularly hurts me. I will have no reserves from you.""","""Mr Darcy is impatient to see his sister; and, to confess the truth, we       are scarcely less eager to meet her again. I really do not think Georgiana       Darcy has her equal for beauty, elegance, and accomplishments; and the       affection she inspires in Louisa and myself is heightened into something       still more interesting, from the hope we dare entertain of her being       hereafter our sister. I do not know whether I ever before mentioned to you       my feelings on this subject; but I will not leave the country without       confiding them, and I trust you will not esteem them unreasonable. My       brother admires her greatly already; he will have frequent opportunity now       of seeing her on the most intimate footing; her relations all wish the       connection as much as his own; and a sister's partiality is not misleading       me, I think, when I call Charles most capable of engaging any woman's       heart. With all these circumsances to favour an attachment, and nothing       to prevent it, am I wrong, my dearest Jane, in indulging the hope of an       event which will secure the happiness of so many?"""
69,720,"""Mr Darcy is impatient to see his sister; and, to confess the truth, we       are scarcely less eager to meet her again. I really do not think Georgiana       Darcy has her equal for beauty, elegance, and accomplishments; and the       affection she inspires in Louisa and myself is heightened into something       still more interesting, from the hope we dare entertain of her being       hereafter our sister. I do not know whether I ever before mentioned to you       my feelings on this subject; but I will not leave the country without       confiding them, and I trust you will not esteem them unreasonable. My       brother admires her greatly already; he will have frequent opportunity now       of seeing her on the most intimate footing; her relations all wish the       connection as much as his own; and a sister's partiality is not misleading       me, I think, when I call Charles most capable of engaging any woman's       heart. With all these circumsances to favour an attachment, and nothing       to prevent it, am I wrong, my dearest Jane, in indulging the hope of an       event which will secure the happiness of so many?""","""What do you think of this sentence, my dear Lizzy?"""
70,721,"""What do you think of this sentence, my dear Lizzy?""","""Yes, there can; for mine is totally different. Will you hear it?"""
71,722,"""Yes, there can; for mine is totally different. Will you hear it?""","""Most willingly."""
72,723,"""Most willingly.""","""You shall have it in a few words. MissBingley sees that her brother is       in love with you, and wants him to marry MissDarcy. She follows him to       town in hope of keeping him there, and tries to persuade you that he does       not care about you."""
73,724,"""You shall have it in a few words. MissBingley sees that her brother is       in love with you, and wants him to marry MissDarcy. She follows him to       town in hope of keeping him there, and tries to persuade you that he does       not care about you.""",Jane shook her head.
74,725,Jane shook her head.,"""Indeed, Jane, you ought to believe me. No one who has ever seen you       together can doubt his affection. MissBingley, I am sure, cannot. She is       not such a simpleton. Could she have seen half as much love in Mr Darcy       for herself, she would have ordered her wedding clothes. But the case is       this: We are not rich enough or grand enough for them; and she is the more       anxious to get MissDarcy for her brother, from the notion that when there       has been one intermarriage, she may have less trouble in achieving       a second; in which there is certainly some ingenuity, and I dare say it       would succeed, if Missde Bourgh were out of the way. But, my dearest       Jane, you cannot seriously imagine that because MissBingley tells you her       brother greatly admires MissDarcy, he is in the smallest degree less       sensible of your merit than when he took leave of you on Tuesday,       or that it will be in her power to persuade him that, instead of being in       love with you, he is very much in love with her friend."""
75,726,"""Indeed, Jane, you ought to believe me. No one who has ever seen you       together can doubt his affection. MissBingley, I am sure, cannot. She is       not such a simpleton. Could she have seen half as much love in Mr Darcy       for herself, she would have ordered her wedding clothes. But the case is       this: We are not rich enough or grand enough for them; and she is the more       anxious to get MissDarcy for her brother, from the notion that when there       has been one intermarriage, she may have less trouble in achieving       a second; in which there is certainly some ingenuity, and I dare say it       would succeed, if Missde Bourgh were out of the way. But, my dearest       Jane, you cannot seriously imagine that because MissBingley tells you her       brother greatly admires MissDarcy, he is in the smallest degree less       sensible of your merit than when he took leave of you on Tuesday,       or that it will be in her power to persuade him that, instead of being in       love with you, he is very much in love with her friend.""","""If we thought alike of MissBingley,"""
76,727,"""If we thought alike of MissBingley,""","""That is right. You could not have started a more happy idea, since you       will not take comfort in mine. Believe her to be deceived, by all means.       You have now done your duty by her, and must fret no longer."""
77,728,"""That is right. You could not have started a more happy idea, since you       will not take comfort in mine. Believe her to be deceived, by all means.       You have now done your duty by her, and must fret no longer.""","""But, my dear sister, can I be happy, even supposing the best, in       accepting a man whose sisters and friends are all wishing him to marry       elsewhere?"""
78,729,"""But, my dear sister, can I be happy, even supposing the best, in       accepting a man whose sisters and friends are all wishing him to marry       elsewhere?""","""You must decide for yourself,"""
79,730,"""You must decide for yourself,""","""How can you talk so?"""
80,731,"""How can you talk so?""","""I did not think you would; and that being the case, I cannot consider       your situation with much compassion."""
81,732,"""I did not think you would; and that being the case, I cannot consider       your situation with much compassion.""","""But if he returns no more this winter, my choice will never be required.       A thousand things may arise in six months!"""
82,733,"""But if he returns no more this winter, my choice will never be required.       A thousand things may arise in six months!""","The idea of his returning no more Elizabeth treated with the utmost       contempt. It appeared to her merely the suggestion of Caroline's       interested wishes, and she could not for a moment suppose that those       wishes, however openly or artfully spoken, could influence a young man so       totally independent of everyone."
83,734,"The idea of his returning no more Elizabeth treated with the utmost       contempt. It appeared to her merely the suggestion of Caroline's       interested wishes, and she could not for a moment suppose that those       wishes, however openly or artfully spoken, could influence a young man so       totally independent of everyone.","She represented to her sister as forcibly as possible what she felt on the       subject, and had soon the pleasure of seeing its happy effect. Jane's       temper was not desponding, and she was gradually led to hope, though the       diffidence of affection sometimes overcame the hope, that Bingley would       return to Netherfield and answer every wish of her heart."
84,735,"She represented to her sister as forcibly as possible what she felt on the       subject, and had soon the pleasure of seeing its happy effect. Jane's       temper was not desponding, and she was gradually led to hope, though the       diffidence of affection sometimes overcame the hope, that Bingley would       return to Netherfield and answer every wish of her heart.","They agreed that Mrs Bennet should only hear of the departure of the       family, without being alarmed on the score of the gentleman's conduct; but       even this partial communication gave her a great deal of concern, and she       bewailed it as exceedingly unlucky that the ladies should happen to go       away just as they were all getting so intimate together. After lamenting       it, however, at some length, she had the consolation that Mr Bingley       would be soon down again and soon dining at Longbourn, and the conclusion       of all was the comfortable declaration, that though he had been invited       only to a family dinner, she would take care to have two full courses."
85,736,"They agreed that Mrs Bennet should only hear of the departure of the       family, without being alarmed on the score of the gentleman's conduct; but       even this partial communication gave her a great deal of concern, and she       bewailed it as exceedingly unlucky that the ladies should happen to go       away just as they were all getting so intimate together. After lamenting       it, however, at some length, she had the consolation that Mr Bingley       would be soon down again and soon dining at Longbourn, and the conclusion       of all was the comfortable declaration, that though he had been invited       only to a family dinner, she would take care to have two full courses.",Chapter 22
86,737,Chapter 22,The Bennets were engaged to dine with the Lucases and again during the       chief of the day was MissLucas so kind as to listen to Mr Collins.       Elizabeth took an opportunity of thanking her. 
87,738,The Bennets were engaged to dine with the Lucases and again during the       chief of the day was MissLucas so kind as to listen to Mr Collins.       Elizabeth took an opportunity of thanking her. ,"In as short a time as Mr Collins's long speeches would allow, everything       was settled between them to the satisfaction of both; and as they entered       the house he earnestly entreated her to name the day that was to make him       the happiest of men; and though such a solicitation must be waived for the       present, the lady felt no inclination to trifle with his happiness. The       stupidity with which he was favoured by nature must guard his courtship       from any charm that could make a woman wish for its continuance; and Miss      Lucas, who accepted him solely from the pure and disinterested desire of       an establishment, cared not how soon that establishment were gained."
