,utter_1,utter_2,label,chapter_tag
855,"""I have never heard him say so; but it is probable that he may spend very       little of his time there in the future. He has many friends, and is at a       time of life when friends and engagements are continually increasing.""","""If he means to be but little at Netherfield, it would be better for the       neighbourhood that he should give up the place entirely, for then we might       possibly get a settled family there. But, perhaps, Mr Bingley did not       take the house so much for the convenience of the neighbourhood as for his       own, and we must expect him to keep it or quit it on the same principle.""",B-OTHER,Chapter 32
856,"""If he means to be but little at Netherfield, it would be better for the       neighbourhood that he should give up the place entirely, for then we might       possibly get a settled family there. But, perhaps, Mr Bingley did not       take the house so much for the convenience of the neighbourhood as for his       own, and we must expect him to keep it or quit it on the same principle.""","""I should not be surprised,""",B-OTHER,Chapter 32
857,"""I should not be surprised,""","""if he were to give it up as soon       as any eligible purchase offers.""",B-OTHER,Chapter 32
858,"""if he were to give it up as soon       as any eligible purchase offers.""","""This seemsa very comfortable       house. Lady Catherine, I believe, did a great deal to it when Mr Collins       first came to Hunsford.""",I-OTHER,Chapter 32
859,"""This seemsa very comfortable       house. Lady Catherine, I believe, did a great deal to it when Mr Collins       first came to Hunsford.""","""I believe she did—and I am sure she could not have bestowed her       kindness on a more grateful object.""",I-OTHER,Chapter 32
860,"""I believe she did—and I am sure she could not have bestowed her       kindness on a more grateful object.""","""Mr Collins appears to be very fortunate in his choice of a wife.""",B-OTHER,Chapter 32
861,"""Mr Collins appears to be very fortunate in his choice of a wife.""","""Yes, indeed, his friends may well rejoice in his having met with one of       the very few sensible women who would have accepted him, or have made him       happy if they had. My friend has an excellent understanding—though I       am not certain that I consider her marrying Mr Collins as the wisest       thing she ever did. She seemsperfectly happy, however, and in a       prudential light it is certainly a very good match for her.""",B-OTHER,Chapter 32
862,"""Yes, indeed, his friends may well rejoice in his having met with one of       the very few sensible women who would have accepted him, or have made him       happy if they had. My friend has an excellent understanding—though I       am not certain that I consider her marrying Mr Collins as the wisest       thing she ever did. She seemsperfectly happy, however, and in a       prudential light it is certainly a very good match for her.""","""It must be very agreeable for her to be settled within so easy a distance       of her own family and friends.""",B-OTHER,Chapter 32
863,"""It must be very agreeable for her to be settled within so easy a distance       of her own family and friends.""","""An easy distance, do you call it? It is nearly fifty miles.""",B-OTHER,Chapter 32
864,"""An easy distance, do you call it? It is nearly fifty miles.""","""And what is fifty miles of good road? Little more than half a day's       journey. Yes, I call it a very easy distance.""",B-OTHER,Chapter 32
865,"""And what is fifty miles of good road? Little more than half a day's       journey. Yes, I call it a very easy distance.""","""I should never have considered the distance as one of the advantages       of the match,""",B-OTHER,Chapter 32
866,"""I should never have considered the distance as one of the advantages       of the match,""","""I should never have said Mrs Collins was       settled near her family.""",B-OTHER,Chapter 32
867,"""I should never have said Mrs Collins was       settled near her family.""","""It is a proof of your own attachment to Hertfordshire. Anything beyond       the very neighbourhood of Longbourn, I suppose, would appear far.""",I-OTHER,Chapter 32
868,"""It is a proof of your own attachment to Hertfordshire. Anything beyond       the very neighbourhood of Longbourn, I suppose, would appear far.""","""I do not mean to say that a woman may not be settled too near her family.       The far and the near must be relative, and depend on many varying       circumsances. Where there is fortune to make the expenses of travelling       unimportant, distance becomes no evil. But that is not the case here.       Mr and Mrs Collins have a comfortable income, but not such a one as will       allow of frequent journeys—and I am persuaded my friend would not       call herself near her family under less than half the       present distance.""",B-OTHER,Chapter 32
869,"""I do not mean to say that a woman may not be settled too near her family.       The far and the near must be relative, and depend on many varying       circumsances. Where there is fortune to make the expenses of travelling       unimportant, distance becomes no evil. But that is not the case here.       Mr and Mrs Collins have a comfortable income, but not such a one as will       allow of frequent journeys—and I am persuaded my friend would not       call herself near her family under less than half the       present distance.""","""You       cannot have a right to such very strong local attachment. You       cannot have been always at Longbourn.""",B-OTHER,Chapter 32
870,"""You       cannot have a right to such very strong local attachment. You       cannot have been always at Longbourn.""","""Are you pleased with Kent?""",I-OTHER,Chapter 32
871,"""Are you pleased with Kent?""","""What can be the meaning of this?""",B-OTHER,Chapter 32
872,"""What can be the meaning of this?""","""My dear, Eliza, he must be in love with you, or he would never have       called us in this familiar way.""",B-OTHER,Chapter 32
873,"""I did not know before that you ever walked this way.""","""I have been making the tour of the park,""",B-START,Chapter 33
874,"""I have been making the tour of the park,""","""as I generally do       every year, and intend to close it with a call at the Parsonage. Are you       going much farther?""",B-OTHER,Chapter 33
875,"""as I generally do       every year, and intend to close it with a call at the Parsonage. Are you       going much farther?""","""No, I should have turned in a moment.""",I-OTHER,Chapter 33
876,"""No, I should have turned in a moment.""","""Do you certainly leave Kent on Saturday?""",B-OTHER,Chapter 33
877,"""Do you certainly leave Kent on Saturday?""","""Yes—if Darcy does not put it off again. But I am at his disposal.       He arranges the business just as he pleases.""",B-OTHER,Chapter 33
878,"""Yes—if Darcy does not put it off again. But I am at his disposal.       He arranges the business just as he pleases.""","""And if not able to please himslf in the arrangement, he has at least       pleasure in the great power of choice. I do not know anybody who seems      more to enjoy the power of doing what he likes than Mr Darcy.""",B-OTHER,Chapter 33
879,"""And if not able to please himslf in the arrangement, he has at least       pleasure in the great power of choice. I do not know anybody who seems      more to enjoy the power of doing what he likes than Mr Darcy.""","""He likes to have his own way very well,""",B-OTHER,Chapter 33
880,"""He likes to have his own way very well,""","""But so we all do. It is only that he has better means of having it than       many others, because he is rich, and many others are poor. I speak       feelingly. A younger son, you know, must be inured to self-denial and       dependence.""",B-OTHER,Chapter 33
881,"""But so we all do. It is only that he has better means of having it than       many others, because he is rich, and many others are poor. I speak       feelingly. A younger son, you know, must be inured to self-denial and       dependence.""","""In my opinion, the younger son of an earl can know very little of either.       Now seriously, what have you ever known of self-denial and dependence?       When have you been prevented by want of money from going wherever you       chose, or procuring anything you had a fancy for?""",I-OTHER,Chapter 33
882,"""In my opinion, the younger son of an earl can know very little of either.       Now seriously, what have you ever known of self-denial and dependence?       When have you been prevented by want of money from going wherever you       chose, or procuring anything you had a fancy for?""","""These are home questions—and perhaps I cannot say that I have       experienced many hardships of that nature. But in matters of greater       weight, I may suffer from want of money. Younger sons cannot marry where       they like.""",B-OTHER,Chapter 33
883,"""These are home questions—and perhaps I cannot say that I have       experienced many hardships of that nature. But in matters of greater       weight, I may suffer from want of money. Younger sons cannot marry where       they like.""","""Unless where they like women of fortune, which I think they very often       do.""",B-OTHER,Chapter 33
884,"""Unless where they like women of fortune, which I think they very often       do.""","""Our habits of expense make us too dependent, and there are not many in my       rank of life who can afford to marry without some attention to money.""",B-OTHER,Chapter 33
885,"""Our habits of expense make us too dependent, and there are not many in my       rank of life who can afford to marry without some attention to money.""","""Is this,""",B-OTHER,Chapter 33
886,"""Is this,""","""meant for me?""",B-OTHER,Chapter 33
887,"""meant for me?""","""And pray, what is       the usual price of an earl's younger son? Unless the elder brother is very       sickly, I suppose you would not ask above fifty thousand pounds.""",I-OTHER,Chapter 33
888,"""And pray, what is       the usual price of an earl's younger son? Unless the elder brother is very       sickly, I suppose you would not ask above fifty thousand pounds.""","""I imagine your cousin brought you down with him chiefly for the sake of       having someone at his disposal. I wonder he does not marry, to secure a       lasting convenience of that kind. But, perhaps, his sister does as well       for the present, and, as she is under his sole care, he may do what he       likes with her.""",I-OTHER,Chapter 33
889,"""I imagine your cousin brought you down with him chiefly for the sake of       having someone at his disposal. I wonder he does not marry, to secure a       lasting convenience of that kind. But, perhaps, his sister does as well       for the present, and, as she is under his sole care, he may do what he       likes with her.""","""No,""",B-OTHER,Chapter 33
890,"""No,""","""that is an advantage which he must divide       with me. I am joined with him in the guardianship of MissDarcy.""",B-OTHER,Chapter 33
891,"""that is an advantage which he must divide       with me. I am joined with him in the guardianship of MissDarcy.""","""Are you indeed? And pray what sort of guardians do you make? Does your       charge give you much trouble? Young ladies of her age are sometimes a       little difficult to manage, and if she has the true Darcy spirit, she may       like to have her own way.""",I-OTHER,Chapter 33
892,"""Are you indeed? And pray what sort of guardians do you make? Does your       charge give you much trouble? Young ladies of her age are sometimes a       little difficult to manage, and if she has the true Darcy spirit, she may       like to have her own way.""","""You need not be frightened. I never heard any harm of her; and I dare say       she is one of the most tractable creatures in the world. She is a very       great favourite with some ladies of my acquaintance, Mrs Hurst and Miss      Bingley. I think I have heard you say that you know them.""",B-OTHER,Chapter 33
893,"""You need not be frightened. I never heard any harm of her; and I dare say       she is one of the most tractable creatures in the world. She is a very       great favourite with some ladies of my acquaintance, Mrs Hurst and Miss      Bingley. I think I have heard you say that you know them.""","""I know them a little. Their brother is a pleasant gentlemanlike man—he       is a great friend of Darcy's.""",B-OTHER,Chapter 33
894,"""I know them a little. Their brother is a pleasant gentlemanlike man—he       is a great friend of Darcy's.""","""Oh! yes,""",B-OTHER,Chapter 33
895,"""Oh! yes,""","""Mr Darcy is uncommonly kind to Mr       Bingley, and takes a prodigious deal of care of him.""",B-OTHER,Chapter 33
896,"""Mr Darcy is uncommonly kind to Mr       Bingley, and takes a prodigious deal of care of him.""","""Care of him! Yes, I really believe Darcy does take care of him in       those points where he most wants care. From something that he told me in       our journey hither, I have reason to think Bingley very much indebted to       him. But I ought to beg his pardon, for I have no right to suppose that       Bingley was the person meant. It was all conjecture.""",I-OTHER,Chapter 33
897,"""Care of him! Yes, I really believe Darcy does take care of him in       those points where he most wants care. From something that he told me in       our journey hither, I have reason to think Bingley very much indebted to       him. But I ought to beg his pardon, for I have no right to suppose that       Bingley was the person meant. It was all conjecture.""","""What is it you mean?""",B-OTHER,Chapter 33
898,"""What is it you mean?""","""It is a circumsance which Darcy could not wish to be generally known,       because if it were to get round to the lady's family, it would be an       unpleasant thing.""",B-OTHER,Chapter 33
899,"""It is a circumsance which Darcy could not wish to be generally known,       because if it were to get round to the lady's family, it would be an       unpleasant thing.""","""You may depend upon my not mentioning it.""",B-OTHER,Chapter 33
900,"""You may depend upon my not mentioning it.""","""And remember that I have not much reason for supposing it to be Bingley.       What he told me was merely this: that he congratulated himslf on having       lately saved a friend from the inconveniences of a most imprudent       marriage, but without mentioning names or any other particulars, and I       only suspected it to be Bingley from believing him the kind of young man       to get into a scrape of that sort, and from knowing them to have been       together the whole of last summer.""",B-OTHER,Chapter 33
901,"""And remember that I have not much reason for supposing it to be Bingley.       What he told me was merely this: that he congratulated himslf on having       lately saved a friend from the inconveniences of a most imprudent       marriage, but without mentioning names or any other particulars, and I       only suspected it to be Bingley from believing him the kind of young man       to get into a scrape of that sort, and from knowing them to have been       together the whole of last summer.""","""Did Mr Darcy give you reasons for this interference?""",B-OTHER,Chapter 33
902,"""Did Mr Darcy give you reasons for this interference?""","""I understood that there were some very strong objections against the       lady.""",B-OTHER,Chapter 33
903,"""I understood that there were some very strong objections against the       lady.""","""And what arts did he use to separate them?""",B-OTHER,Chapter 33
904,"""And what arts did he use to separate them?""","""He did not talk to me of his own arts,""",B-OTHER,Chapter 33
905,"""He did not talk to me of his own arts,""","""He       only told me what I have now told you.""",B-OTHER,Chapter 33
906,"""He       only told me what I have now told you.""","""I am thinking of what you have been telling me,""",I-OTHER,Chapter 33
907,"""I am thinking of what you have been telling me,""","""Your cousin's       conduct does not suit my feelings. Why was he to be the judge?""",B-OTHER,Chapter 33
908,"""Your cousin's       conduct does not suit my feelings. Why was he to be the judge?""","""You are rather disposed to call his interference officious?""",I-OTHER,Chapter 33
909,"""You are rather disposed to call his interference officious?""","""I do not see what right Mr Darcy had to decide on the propriety of his       friend's inclination, or why, upon his own judgement alone, he was to       determine and direct in what manner his friend was to be happy. But,""",B-OTHER,Chapter 33
910,"""I do not see what right Mr Darcy had to decide on the propriety of his       friend's inclination, or why, upon his own judgement alone, he was to       determine and direct in what manner his friend was to be happy. But,""","""as we know none of the particulars, it       is not fair to condemn him. It is not to be supposed that there was much       affection in the case.""",B-OTHER,Chapter 33
911,"""as we know none of the particulars, it       is not fair to condemn him. It is not to be supposed that there was much       affection in the case.""","""That is not an unnatural surmise,""",I-OTHER,Chapter 33
912,"""That is not an unnatural surmise,""","""but it is a       lessening of the honour of my cousin's triumph very sadly.""",B-OTHER,Chapter 33
913,"""but it is a       lessening of the honour of my cousin's triumph very sadly.""","""There were some very strong objections against the lady,""",I-OTHER,Chapter 33
914,"""There were some very strong objections against the lady,""","""To Jane herself,""",B-OTHER,Chapter 33
915,"""To Jane herself,""","""there could be no possibility of       objection; all loveliness and goodness as she is!—her understanding       excellent, her mind improved, and her manners captivating. Neither could       anything be urged against my father, who, though with some peculiarities,       has abilities Mr Darcy himslf need not disdain, and respectability which       he will probably never reach.""",B-OTHER,Chapter 33
916,"""In vain I have struggled. It will not do. My feelings will not be       repressed. You must allow me to tell you how ardently I admire and love       you.""","""In such cases as this, it is, I believe, the established mode to express       a sense of obligation for the sentiments avowed, however unequally they       may be returned. It is natural that obligation should be felt, and if I       could feel gratitude, I would now thank you. But I cannot—I       have never desired your good opinion, and you have certainly bestowed it       most unwillingly. I am sorry to have occasioned pain to anyone. It has       been most unconsciously done, however, and I hope will be of short       duration. The feelings which, you tell me, have long prevented the       acknowledgment of your regard, can have little difficulty in overcoming it       after this explanation.""",B-START,Chapter 34
917,"""In such cases as this, it is, I believe, the established mode to express       a sense of obligation for the sentiments avowed, however unequally they       may be returned. It is natural that obligation should be felt, and if I       could feel gratitude, I would now thank you. But I cannot—I       have never desired your good opinion, and you have certainly bestowed it       most unwillingly. I am sorry to have occasioned pain to anyone. It has       been most unconsciously done, however, and I hope will be of short       duration. The feelings which, you tell me, have long prevented the       acknowledgment of your regard, can have little difficulty in overcoming it       after this explanation.""","""And this is all the reply which I am to have the honour of expecting! I       might, perhaps, wish to be informed why, with so little endeavour       at civility, I am thus rejected. But it is of small importance.""",B-OTHER,Chapter 34
918,"""And this is all the reply which I am to have the honour of expecting! I       might, perhaps, wish to be informed why, with so little endeavour       at civility, I am thus rejected. But it is of small importance.""","""I might as well inquire,""",B-OTHER,Chapter 34
919,"""I might as well inquire,""","""why with so evident a desire of       offending and insulting me, you chose to tell me that you liked me against       your will, against your reason, and even against your character? Was not       this some excuse for incivility, if I was uncivil? But I have other       provocations. You know I have. Had not my feelings decided against you—had       they been indifferent, or had they even been favourable, do you think that       any consideration would tempt me to accept the man who has been the means       of ruining, perhaps for ever, the happiness of a most beloved sister?""",B-OTHER,Chapter 34
920,"""why with so evident a desire of       offending and insulting me, you chose to tell me that you liked me against       your will, against your reason, and even against your character? Was not       this some excuse for incivility, if I was uncivil? But I have other       provocations. You know I have. Had not my feelings decided against you—had       they been indifferent, or had they even been favourable, do you think that       any consideration would tempt me to accept the man who has been the means       of ruining, perhaps for ever, the happiness of a most beloved sister?""","""I have every reason in the world to think ill of you. No motive can       excuse the unjust and ungenerous part you acted there. You dare       not, you cannot deny, that you have been the principal, if not the only       means of dividing them from each other—of exposing one to the       censure of the world for caprice and instability, and the other to its       derision for disappointed hopes, and involving them both in misery of the       acutest kind.""",I-OTHER,Chapter 34
921,"""I have every reason in the world to think ill of you. No motive can       excuse the unjust and ungenerous part you acted there. You dare       not, you cannot deny, that you have been the principal, if not the only       means of dividing them from each other—of exposing one to the       censure of the world for caprice and instability, and the other to its       derision for disappointed hopes, and involving them both in misery of the       acutest kind.""","""Can you deny that you have done it?""",B-OTHER,Chapter 34
922,"""Can you deny that you have done it?""","""I have no wish of denying that       I did everything in my power to separate my friend from your sister, or       that I rejoice in my success. Towards him I have been kinder than       towards myself.""",B-OTHER,Chapter 34
923,"""I have no wish of denying that       I did everything in my power to separate my friend from your sister, or       that I rejoice in my success. Towards him I have been kinder than       towards myself.""","""But it is not merely this affair,""",I-OTHER,Chapter 34
924,"""But it is not merely this affair,""","""on which my dislike is       founded. Long before it had taken place my opinion of you was decided.       Your character was unfolded in the recital which I received many months       ago from Mr Wickham. On this subject, what can you have to say? In what       imaginary act of friendship can you here defend yourself? or under what       misrepresentation can you here impose upon others?""",B-OTHER,Chapter 34
925,"""on which my dislike is       founded. Long before it had taken place my opinion of you was decided.       Your character was unfolded in the recital which I received many months       ago from Mr Wickham. On this subject, what can you have to say? In what       imaginary act of friendship can you here defend yourself? or under what       misrepresentation can you here impose upon others?""","""You take an eager interest in that gentleman's concerns,""",I-OTHER,Chapter 34
926,"""You take an eager interest in that gentleman's concerns,""","""Who that knows what his misfortunes have been, can help feeling an       interest in him?""",B-OTHER,Chapter 34
927,"""Who that knows what his misfortunes have been, can help feeling an       interest in him?""","""His misfortunes!""",B-OTHER,Chapter 34
928,"""His misfortunes!""","""yes, his misfortunes       have been great indeed.""",B-OTHER,Chapter 34
929,"""yes, his misfortunes       have been great indeed.""","""And of your infliction,""",I-OTHER,Chapter 34
930,"""And of your infliction,""","""You have reduced       him to his present state of poverty—comparative poverty. You have       withheld the advantages which you must know to have been designed for him.       You have deprived the best years of his life of that independence which       was no less his due than his desert. You have done all this! and yet you       can treat the mention of his misfortune with contempt and ridicule.""",B-OTHER,Chapter 34
931,"""You have reduced       him to his present state of poverty—comparative poverty. You have       withheld the advantages which you must know to have been designed for him.       You have deprived the best years of his life of that independence which       was no less his due than his desert. You have done all this! and yet you       can treat the mention of his misfortune with contempt and ridicule.""","""And this,""",I-OTHER,Chapter 34
932,"""And this,""","""is your opinion of me! This is the estimation in which you hold me! I       thank you for explaining it so fully. My faults, according to this       calculation, are heavy indeed! But perhaps,""",B-OTHER,Chapter 34
