,utter_1,utter_2,label,chapter_tag
1163,"""Of whom does Jane ever think ill? And who is there, whatever might be       their former conduct, that she would think capable of such an attempt,       till it were proved against them? But Jane knows, as well as I do, what       Wickham really is. We both know that he has been profligate in every sense       of the word; that he has neither integrity nor honour; that he is as false       and deceitful as he is insinuating.""","""And do you really know all this?""",B-OTHER,Chapter 47
1164,"""And do you really know all this?""","""I do indeed,""",B-OTHER,Chapter 47
1165,"""I do indeed,""","""I told you, the other day,       of his infamous behaviour to Mr Darcy; and you yourself, when last at       Longbourn, heard in what manner he spoke of the man who had behaved with       such forbearance and liberality towards him. And there are other       circumsances which I am not at liberty—which it is not worth while       to relate; but his lies about the whole Pemberley family are endless. From       what he said of MissDarcy I was thoroughly prepared to see a proud,       reserved, disagreeable girl. Yet he knew to the contrary himslf. He must       know that she was as amiable and unpretending as we have found her.""",B-OTHER,Chapter 47
1166,"""I told you, the other day,       of his infamous behaviour to Mr Darcy; and you yourself, when last at       Longbourn, heard in what manner he spoke of the man who had behaved with       such forbearance and liberality towards him. And there are other       circumsances which I am not at liberty—which it is not worth while       to relate; but his lies about the whole Pemberley family are endless. From       what he said of MissDarcy I was thoroughly prepared to see a proud,       reserved, disagreeable girl. Yet he knew to the contrary himslf. He must       know that she was as amiable and unpretending as we have found her.""","""But does Lydia know nothing of this? can she be ignorant of what you and       Jane seem so well to understand?""",I-OTHER,Chapter 47
1167,"""But does Lydia know nothing of this? can she be ignorant of what you and       Jane seem so well to understand?""","""Oh, yes!—that, that is the worst of all. Till I was in Kent, and       saw so much both of Mr Darcy and his relation Colonel Fitzwilliam, I was       ignorant of the truth myself. And when I returned home, the ——shire       was to leave Meryton in a week or fortnight's time. As that was the case,       neither Jane, to whom I related the whole, nor I, thought it necessary to       make our knowledge public; for of what use could it apparently be to any       one, that the good opinion which all the neighbourhood had of him should       then be overthrown? And even when it was settled that Lydia should go with       Mrs Forster, the necessity of opening her eyes to his character never       occurred to me. That she could be in any danger from the deception       never entered my head. That such a consequence as this could ensue,       you may easily believe, was far enough from my thoughts.""",B-OTHER,Chapter 47
1168,"""Oh, yes!—that, that is the worst of all. Till I was in Kent, and       saw so much both of Mr Darcy and his relation Colonel Fitzwilliam, I was       ignorant of the truth myself. And when I returned home, the ——shire       was to leave Meryton in a week or fortnight's time. As that was the case,       neither Jane, to whom I related the whole, nor I, thought it necessary to       make our knowledge public; for of what use could it apparently be to any       one, that the good opinion which all the neighbourhood had of him should       then be overthrown? And even when it was settled that Lydia should go with       Mrs Forster, the necessity of opening her eyes to his character never       occurred to me. That she could be in any danger from the deception       never entered my head. That such a consequence as this could ensue,       you may easily believe, was far enough from my thoughts.""","""When they all removed to Brighton, therefore, you had no reason, I       suppose, to believe them fond of each other?""",B-OTHER,Chapter 47
1169,"""When they all removed to Brighton, therefore, you had no reason, I       suppose, to believe them fond of each other?""","""Not the slightest. I can remember no symptom of affection on either side;       and had anything of the kind been perceptible, you must be aware that ours       is not a family on which it could be thrown away. When first he entered       the corps, she was ready enough to admire him; but so we all were. Every       girl in or near Meryton was out of her senses about him for the first two       months; but he never distinguished her by any particular attention;       and, consequently, after a moderate period of extravagant and wild       admiration, her fancy for him gave way, and others of the regiment, who       treated her with more distinction, again became her favourites.""",B-OTHER,Chapter 47
1170,"""Not yet,""","""But now that my dear uncle is come, I hope       everything will be well.""",B-START,Chapter 47
1171,"""But now that my dear uncle is come, I hope       everything will be well.""","""Is my father in town?""",I-START,Chapter 47
1172,"""Is my father in town?""","""Yes, he went on Tuesday, as I wrote you word.""",B-OTHER,Chapter 47
1173,"""Yes, he went on Tuesday, as I wrote you word.""","""And have you heard from him often?""",B-OTHER,Chapter 47
1174,"""And have you heard from him often?""","""We have heard only twice. He wrote me a few lines on Wednesday to say       that he had arrived in safety, and to give me his directions, which I       particularly begged him to do. He merely added that he should not write       again till he had something of importance to mention.""",B-OTHER,Chapter 47
1175,"""We have heard only twice. He wrote me a few lines on Wednesday to say       that he had arrived in safety, and to give me his directions, which I       particularly begged him to do. He merely added that he should not write       again till he had something of importance to mention.""","""And my mother—how is she? How are you all?""",B-OTHER,Chapter 47
1176,"""And my mother—how is she? How are you all?""","""My mother is tolerably well, I trust; though her spirits are greatly       shaken. She is up stairs and will have great satisfaction in seeing you       all. She does not yet leave her dressing-room. Mary and Kitty, thank       Heaven, are quite well.""",B-OTHER,Chapter 47
1177,"""My mother is tolerably well, I trust; though her spirits are greatly       shaken. She is up stairs and will have great satisfaction in seeing you       all. She does not yet leave her dressing-room. Mary and Kitty, thank       Heaven, are quite well.""","""But you—how are you?""",B-OTHER,Chapter 47
1178,"""But you—how are you?""","""You look pale. How much you       must have gone through!""",B-OTHER,Chapter 47
1179,"""If I had been able,""","""to carry my point in going to Brighton,       with all my family, this would not have happened; but poor dear       Lydia had nobody to take care of her. Why did the Forsters ever let her go       out of their sight? I am sure there was some great neglect or other on       their side, for she is not the kind of girl to do such a thing if she had       been well looked after. I always thought they were very unfit to have the       charge of her; but I was overruled, as I always am. Poor dear child! And       now here's Mr Bennet gone away, and I know he will fight Wickham,       wherever he meets him and then he will be killed, and what is to become of       us all? The Collinses will turn us out before he is cold in his grave, and       if you are not kind to us, brother, I do not know what we shall do.""",B-START,Chapter 47
1180,"""to carry my point in going to Brighton,       with all my family, this would not have happened; but poor dear       Lydia had nobody to take care of her. Why did the Forsters ever let her go       out of their sight? I am sure there was some great neglect or other on       their side, for she is not the kind of girl to do such a thing if she had       been well looked after. I always thought they were very unfit to have the       charge of her; but I was overruled, as I always am. Poor dear child! And       now here's Mr Bennet gone away, and I know he will fight Wickham,       wherever he meets him and then he will be killed, and what is to become of       us all? The Collinses will turn us out before he is cold in his grave, and       if you are not kind to us, brother, I do not know what we shall do.""","""Do not give way to useless alarm,""",I-START,Chapter 47
1181,"""Do not give way to useless alarm,""","""though it is right to be       prepared for the worst, there is no occasion to look on it as certain. It       is not quite a week since they left Brighton. In a few days more we may       gain some news of them; and till we know that they are not married, and       have no design of marrying, do not let us give the matter over as lost. As       soon as I get to town I shall go to my brother, and make him come home       with me to Gracechurch Street; and then we may consult together as to what       is to be done.""",B-OTHER,Chapter 47
1182,"""though it is right to be       prepared for the worst, there is no occasion to look on it as certain. It       is not quite a week since they left Brighton. In a few days more we may       gain some news of them; and till we know that they are not married, and       have no design of marrying, do not let us give the matter over as lost. As       soon as I get to town I shall go to my brother, and make him come home       with me to Gracechurch Street; and then we may consult together as to what       is to be done.""","""Oh! my dear brother,""",I-OTHER,Chapter 47
1183,"""Oh! my dear brother,""","""that is exactly what I could       most wish for. And now do, when you get to town, find them out, wherever       they may be; and if they are not married already, make them marry.       And as for wedding clothes, do not let them wait for that, but tell Lydia       she shall have as much money as she chooses to buy them, after they are       married. And, above all, keep Mr Bennet from fighting. Tell him what a       dreadful state I am in, that I am frighted out of my wits—and have       such tremblings, such flutterings, all over me—such spasmsin my       side and pains in my head, and such beatings at heart, that I can get no       rest by night nor by day. And tell my dear Lydia not to give any       directions about her clothes till she has seen me, for she does not know       which are the best warehouses. Oh, brother, how kind you are! I know you       will contrive it all.""",B-OTHER,Chapter 47
1184,"""This is a most unfortunate affair, and will probably be much talked of.       But we must stem the tide of malice, and pour into the wounded bosomsof       each other the balm of sisterly consolation.""","""Unhappy as the event must be for Lydia, we may draw from it this useful       lesson: that loss of virtue in a female is irretrievable; that one false       step involves her in endless ruin; that her reputation is no less brittle       than it is beautiful; and that she cannot be too much guarded in her       behaviour towards the undeserving of the other sex.""",B-START,Chapter 47
1185,"""Unhappy as the event must be for Lydia, we may draw from it this useful       lesson: that loss of virtue in a female is irretrievable; that one false       step involves her in endless ruin; that her reputation is no less brittle       than it is beautiful; and that she cannot be too much guarded in her       behaviour towards the undeserving of the other sex.""","""But tell me all and everything about it which I have       not already heard. Give me further particulars. What did Colonel Forster       say? Had they no apprehension of anything before the elopement took place?       They must have seen them together for ever.""",I-OTHER,Chapter 47
1186,"""But tell me all and everything about it which I have       not already heard. Give me further particulars. What did Colonel Forster       say? Had they no apprehension of anything before the elopement took place?       They must have seen them together for ever.""","""Colonel Forster did own that he had often suspected some partiality,       especially on Lydia's side, but nothing to give him any alarm. I am so       grieved for him! His behaviour was attentive and kind to the utmost. He was       coming to us, in order to assure us of his concern, before he had any idea       of their not being gone to Scotland: when that apprehension first got       abroad, it hastened his journey.""",I-OTHER,Chapter 47
1187,"""Colonel Forster did own that he had often suspected some partiality,       especially on Lydia's side, but nothing to give him any alarm. I am so       grieved for him! His behaviour was attentive and kind to the utmost. He was       coming to us, in order to assure us of his concern, before he had any idea       of their not being gone to Scotland: when that apprehension first got       abroad, it hastened his journey.""","""And was Denny convinced that Wickham would not marry? Did he know of       their intending to go off? Had Colonel Forster seen Denny himslf?""",B-OTHER,Chapter 47
1188,"""And was Denny convinced that Wickham would not marry? Did he know of       their intending to go off? Had Colonel Forster seen Denny himslf?""","""Yes; but, when questioned by him, Denny denied knowing anything of       their plans, and would not give his real opinion about it. He did not       repeat his persuasion of their not marrying—and from that, I       am inclined to hope, he might have been misunderstood before.""",B-OTHER,Chapter 47
1189,"""Yes; but, when questioned by him, Denny denied knowing anything of       their plans, and would not give his real opinion about it. He did not       repeat his persuasion of their not marrying—and from that, I       am inclined to hope, he might have been misunderstood before.""","""And till Colonel Forster came himslf, not one of you entertained a       doubt, I suppose, of their being really married?""",B-OTHER,Chapter 47
1190,"""And till Colonel Forster came himslf, not one of you entertained a       doubt, I suppose, of their being really married?""","""How was it possible that such an idea should enter our brains? I felt a       little uneasy—a little fearful of my sister's happiness with him in       marriage, because I knew that his conduct had not been always quite right.       My father and mother knew nothing of that; they only felt how imprudent a       match it must be. Kitty then owned, with a very natural triumph on knowing       more than the rest of us, that in Lydia's last letter she had prepared her       for such a step. She had known, it seems of their being in love with each       other, many weeks.""",B-OTHER,Chapter 47
1191,"""How was it possible that such an idea should enter our brains? I felt a       little uneasy—a little fearful of my sister's happiness with him in       marriage, because I knew that his conduct had not been always quite right.       My father and mother knew nothing of that; they only felt how imprudent a       match it must be. Kitty then owned, with a very natural triumph on knowing       more than the rest of us, that in Lydia's last letter she had prepared her       for such a step. She had known, it seems of their being in love with each       other, many weeks.""","""But not before they went to Brighton?""",B-OTHER,Chapter 47
1192,"""But not before they went to Brighton?""","""No, I believe not.""",B-OTHER,Chapter 47
1193,"""No, I believe not.""","""And did Colonel Forster appear to think well of Wickham himslf? Does he       know his real character?""",B-OTHER,Chapter 47
1194,"""And did Colonel Forster appear to think well of Wickham himslf? Does he       know his real character?""","""I must confess that he did not speak so well of Wickham as he formerly       did. He believed him to be imprudent and extravagant. And since this sad       affair has taken place, it is said that he left Meryton greatly in debt;       but I hope this may be false.""",B-OTHER,Chapter 47
1195,"""I must confess that he did not speak so well of Wickham as he formerly       did. He believed him to be imprudent and extravagant. And since this sad       affair has taken place, it is said that he left Meryton greatly in debt;       but I hope this may be false.""","""Oh, Jane, had we been less secret, had we told what we knew of him, this       could not have happened!""",B-OTHER,Chapter 47
1196,"""Oh, Jane, had we been less secret, had we told what we knew of him, this       could not have happened!""","""Perhaps it would have been better,""",B-OTHER,Chapter 47
1197,"""Perhaps it would have been better,""","""But to expose       the former faults of any person without knowing what their present       feelings were, seemed unjustifiable. We acted with the best intentions.""",B-OTHER,Chapter 47
1198,"""But to expose       the former faults of any person without knowing what their present       feelings were, seemed unjustifiable. We acted with the best intentions.""","""Could Colonel Forster repeat the particulars of Lydia's note to his       wife?""",I-OTHER,Chapter 47
1199,"""Could Colonel Forster repeat the particulars of Lydia's note to his       wife?""","""He brought it with him for us to see.""",B-OTHER,Chapter 47
1200,"""LYDIA BENNET.""","""Oh! thoughtless, thoughtless Lydia!""",B-START,Chapter 47
1201,"""Oh! thoughtless, thoughtless Lydia!""","""What a letter is this, to be written at such a moment! But       at least it shows that she was serious on the subject of their       journey. Whatever he might afterwards persuade her to, it was not on her       side a scheme of infamy. My poor father! how he must have felt it!""",B-OTHER,Chapter 47
1202,"""What a letter is this, to be written at such a moment! But       at least it shows that she was serious on the subject of their       journey. Whatever he might afterwards persuade her to, it was not on her       side a scheme of infamy. My poor father! how he must have felt it!""","""I never saw anyone so shocked. He could not speak a word for full ten       minutes. My mother was taken ill immediately, and the whole house in such       confusion!""",I-OTHER,Chapter 47
1203,"""I never saw anyone so shocked. He could not speak a word for full ten       minutes. My mother was taken ill immediately, and the whole house in such       confusion!""","""Oh! Jane,""",B-OTHER,Chapter 47
1204,"""Oh! Jane,""","""was there a servant belonging to it who did       not know the whole story before the end of the day?""",B-OTHER,Chapter 47
1205,"""was there a servant belonging to it who did       not know the whole story before the end of the day?""","""I do not know. I hope there was. But to be guarded at such a time is very       difficult. My mother was in hysterics, and though I endeavoured to give       her every assistance in my power, I am afraid I did not do so much as I       might have done! But the horror of what might possibly happen almost took       from me my faculties.""",I-OTHER,Chapter 47
1206,"""I do not know. I hope there was. But to be guarded at such a time is very       difficult. My mother was in hysterics, and though I endeavoured to give       her every assistance in my power, I am afraid I did not do so much as I       might have done! But the horror of what might possibly happen almost took       from me my faculties.""","""Your attendance upon her has been too much for you. You do not look well.       Oh that I had been with you! you have had every care and anxiety upon       yourself alone.""",B-OTHER,Chapter 47
1207,"""Your attendance upon her has been too much for you. You do not look well.       Oh that I had been with you! you have had every care and anxiety upon       yourself alone.""","""Mary and Kitty have been very kind, and would have shared in every       fatigue, I am sure; but I did not think it right for either of them. Kitty       is slight and delicate; and Mary studies so much, that her hours of repose       should not be broken in on. My aunt Phillips came to Longbourn on Tuesday,       after my father went away; and was so good as to stay till Thursday with       me. She was of great use and comfort to us all. And Lady Lucas has been       very kind; she walked here on Wednesday morning to condole with us, and       offered her services, or any of her daughters', if they should be of use       to us.""",B-OTHER,Chapter 47
1208,"""Mary and Kitty have been very kind, and would have shared in every       fatigue, I am sure; but I did not think it right for either of them. Kitty       is slight and delicate; and Mary studies so much, that her hours of repose       should not be broken in on. My aunt Phillips came to Longbourn on Tuesday,       after my father went away; and was so good as to stay till Thursday with       me. She was of great use and comfort to us all. And Lady Lucas has been       very kind; she walked here on Wednesday morning to condole with us, and       offered her services, or any of her daughters', if they should be of use       to us.""","""She had better have stayed at home,""",B-OTHER,Chapter 47
1209,"""She had better have stayed at home,""","""perhaps she meant       well, but, under such a misfortune as this, one cannot see too little of       one's neighbours. Assistance is impossible; condolence insufferable. Let       them triumph over us at a distance, and be satisfied.""",B-OTHER,Chapter 47
1210,"""perhaps she meant       well, but, under such a misfortune as this, one cannot see too little of       one's neighbours. Assistance is impossible; condolence insufferable. Let       them triumph over us at a distance, and be satisfied.""","""He meant I believe,""",I-OTHER,Chapter 47
1211,"""He meant I believe,""","""to go to Epsom, the place where they       last changed horses, see the postilions and try if anything could be made       out from them. His principal object must be to discover the number of the       hackney coach which took them from Clapham. It had come with a fare from       London; and as he thought that the circumsance of a gentleman and lady's       removing from one carriage into another might be remarked he meant to make       inquiries at Clapham. If he could anyhow discover at what house the       coachman had before set down his fare, he determined to make inquiries       there, and hoped it might not be impossible to find out the stand and       number of the coach. I do not know of any other designs that he had       formed; but he was in such a hurry to be gone, and his spirits so greatly       discomposed, that I had difficulty in finding out even so much as this.""",B-OTHER,Chapter 47
1212,"""I am, dear sir, etc., etc.""","""A gamester!""",B-START,Chapter 48
1213,"""A gamester!""","""This is wholly unexpected. I had not an       idea of it.""",I-OTHER,Chapter 48
1214,"""This is wholly unexpected. I had not an       idea of it.""","""What, is he coming home, and without poor Lydia?""",I-OTHER,Chapter 48
1215,"""What, is he coming home, and without poor Lydia?""","""Sure he       will not leave London before he has found them. Who is to fight Wickham,       and make him marry her, if he comes away?""",B-OTHER,Chapter 48
1216,"""Sure he       will not leave London before he has found them. Who is to fight Wickham,       and make him marry her, if he comes away?""","""Say       nothing of that. Who should suffer but myself? It has been my own doing,       and I ought to feel it.""",I-OTHER,Chapter 48
1217,"""You must not be too severe upon yourself,""","""You may well warn me against such an evil. Human nature is so prone to       fall into it! No, Lizzy, let me once in my life feel how much I have been       to blame. I am not afraid of being overpowered by the impression. It will       pass away soon enough.""",B-START,Chapter 48
1218,"""You may well warn me against such an evil. Human nature is so prone to       fall into it! No, Lizzy, let me once in my life feel how much I have been       to blame. I am not afraid of being overpowered by the impression. It will       pass away soon enough.""","""Do you suppose them to be in London?""",B-OTHER,Chapter 48
1219,"""Do you suppose them to be in London?""","""Yes; where else can they be so well concealed?""",B-OTHER,Chapter 48
1220,"""Yes; where else can they be so well concealed?""","""And Lydia used to want to go to London,""",B-OTHER,Chapter 48
1221,"""And Lydia used to want to go to London,""","""She is happy then,""",B-OTHER,Chapter 48
1222,"""She is happy then,""","""and her residence there will       probably be of some duration.""",B-OTHER,Chapter 48
1223,"""and her residence there will       probably be of some duration.""","""Lizzy, I bear you no ill-will for being justified in your advice to me       last May, which, considering the event, shows some greatness of mind.""",I-OTHER,Chapter 48
1224,"""Lizzy, I bear you no ill-will for being justified in your advice to me       last May, which, considering the event, shows some greatness of mind.""","""This is a parade,""",B-OTHER,Chapter 48
1225,"""This is a parade,""","""which does one good; it gives such an       elegance to misfortune! Another day I will do the same; I will sit in my       library, in my nightcap and powdering gown, and give as much trouble as I       can; or, perhaps, I may defer it till Kitty runs away.""",B-OTHER,Chapter 48
