,utter_1,utter_2,label,chapter_tag
503,"""I wish I could call her amiable. It gives me pain to       speak ill of a Darcy. But she is too much like her brother—very,       very proud. As a child, she was affectionate and pleasing, and extremely       fond of me; and I have devoted hours and hours to her amusement. But she       is nothing to me now. She is a handsome girl, about fifteen or sixteen,       and, I understand, highly accomplished. Since her father's death, her home       has been London, where a lady lives with her, and superintends her       education.""","""I am astonished at his intimacy with Mr Bingley! How can Mr Bingley,       who seemsgood humour itself, and is, I really believe, truly amiable, be       in friendship with such a man? How can they suit each other? Do you know       Mr Bingley?""",I-OTHER,Chapter 16
504,"""I am astonished at his intimacy with Mr Bingley! How can Mr Bingley,       who seemsgood humour itself, and is, I really believe, truly amiable, be       in friendship with such a man? How can they suit each other? Do you know       Mr Bingley?""","""Not at all.""",B-OTHER,Chapter 16
505,"""Not at all.""","""He is a sweet-tempered, amiable, charming man. He cannot know what Mr       Darcy is.""",B-OTHER,Chapter 16
506,"""He is a sweet-tempered, amiable, charming man. He cannot know what Mr       Darcy is.""","""Probably not; but Mr Darcy can please where he chooses. He does not want       abilities. He can be a conversible companion if he thinks it worth his       while. Among those who are at all his equals in consequence, he is a very       different man from what he is to the less prosperous. His pride never       deserts him; but with the rich he is liberal-minded, just, sincere,       rational, honourable, and perhaps agreeable—allowing something for       fortune and figure.""",B-OTHER,Chapter 16
507,"""Probably not; but Mr Darcy can please where he chooses. He does not want       abilities. He can be a conversible companion if he thinks it worth his       while. Among those who are at all his equals in consequence, he is a very       different man from what he is to the less prosperous. His pride never       deserts him; but with the rich he is liberal-minded, just, sincere,       rational, honourable, and perhaps agreeable—allowing something for       fortune and figure.""","""I know very well, madam,""",B-OTHER,Chapter 16
508,"""I know very well, madam,""","""that when persons sit down to a       card-table, they must take their chances of these things, and happily I am       not in such circumsances as to make five shillings any object. There are       undoubtedly many who could not say the same, but thanks to Lady Catherine       de Bourgh, I am removed far beyond the necessity of regarding little       matters.""",B-OTHER,Chapter 16
509,"""that when persons sit down to a       card-table, they must take their chances of these things, and happily I am       not in such circumsances as to make five shillings any object. There are       undoubtedly many who could not say the same, but thanks to Lady Catherine       de Bourgh, I am removed far beyond the necessity of regarding little       matters.""","""Lady Catherine de Bourgh,""",I-OTHER,Chapter 16
510,"""Lady Catherine de Bourgh,""","""has very lately given him a       living. I hardly know how Mr Collins was first introduced to her notice,       but he certainly has not known her long.""",B-OTHER,Chapter 16
511,"""has very lately given him a       living. I hardly know how Mr Collins was first introduced to her notice,       but he certainly has not known her long.""","""You know of course that Lady Catherine de Bourgh and Lady Anne Darcy were       sisters; consequently that she is aunt to the present Mr Darcy.""",I-OTHER,Chapter 16
512,"""You know of course that Lady Catherine de Bourgh and Lady Anne Darcy were       sisters; consequently that she is aunt to the present Mr Darcy.""","""No, indeed, I did not. I knew nothing at all of Lady Catherine's       connections. I never heard of her existence till the day before       yesterday.""",B-OTHER,Chapter 16
513,"""No, indeed, I did not. I knew nothing at all of Lady Catherine's       connections. I never heard of her existence till the day before       yesterday.""","""Her daughter, Missde Bourgh, will have a very large fortune, and it is       believed that she and her cousin will unite the two estates.""",B-OTHER,Chapter 16
514,"""Her daughter, Missde Bourgh, will have a very large fortune, and it is       believed that she and her cousin will unite the two estates.""","""Mr Collins,""",B-OTHER,Chapter 16
515,"""Mr Collins,""","""speaks highly both of Lady Catherine and her       daughter; but from some particulars that he has related of her ladyship, I       suspect his gratitude misleads him, and that in spite of her being his       patroness, she is an arrogant, conceited woman.""",B-OTHER,Chapter 16
516,"""speaks highly both of Lady Catherine and her       daughter; but from some particulars that he has related of her ladyship, I       suspect his gratitude misleads him, and that in spite of her being his       patroness, she is an arrogant, conceited woman.""","""I believe her to be both in a great degree,""",I-OTHER,Chapter 16
517,"""I believe her to be both in a great degree,""","""I have not       seen her for many years, but I very well remember that I never liked her,       and that her manners were dictatorial and insolent. She has the reputation       of being remarkably sensible and clever; but I rather believe she derives       part of her abilities from her rank and fortune, part from her       authoritative manner, and the rest from the pride for her nephew, who       chooses that everyone connected with him should have an understanding of       the first class.""",B-OTHER,Chapter 16
518,"""They have both,""","""been deceived, I dare say, in some way or       other, of which we can form no idea. Interested people have perhaps       misrepresented each to the other. It is, in short, impossible for us to       conjecture the causes or circumsances which may have alienated them,       without actual blame on either side.""",B-START,Chapter 17
519,"""been deceived, I dare say, in some way or       other, of which we can form no idea. Interested people have perhaps       misrepresented each to the other. It is, in short, impossible for us to       conjecture the causes or circumsances which may have alienated them,       without actual blame on either side.""","""Very true, indeed; and now, my dear Jane, what have you got to say on       behalf of the interested people who have probably been concerned in the       business? Do clear them too, or we shall be obliged to think ill of       somebody.""",I-START,Chapter 17
520,"""Very true, indeed; and now, my dear Jane, what have you got to say on       behalf of the interested people who have probably been concerned in the       business? Do clear them too, or we shall be obliged to think ill of       somebody.""","""Laugh as much as you choose, but you will not laugh me out of my opinion.       My dearest Lizzy, do but consider in what a disgraceful light it places       Mr Darcy, to be treating his father's favourite in such a manner, one       whom his father had promised to provide for. It is impossible. No man of       common humanity, no man who had any value for his character, could be       capable of it. Can his most intimate friends be so excessively deceived in       him? Oh! no.""",B-OTHER,Chapter 17
521,"""Laugh as much as you choose, but you will not laugh me out of my opinion.       My dearest Lizzy, do but consider in what a disgraceful light it places       Mr Darcy, to be treating his father's favourite in such a manner, one       whom his father had promised to provide for. It is impossible. No man of       common humanity, no man who had any value for his character, could be       capable of it. Can his most intimate friends be so excessively deceived in       him? Oh! no.""","""I can much more easily believe Mr Bingley's being imposed on, than that       Mr Wickham should invent such a history of himslf as he gave me last       night; names, facts, everything mentioned without ceremony. If it be not       so, let Mr Darcy contradict it. Besides, there was truth in his looks.""",B-OTHER,Chapter 17
522,"""I can much more easily believe Mr Bingley's being imposed on, than that       Mr Wickham should invent such a history of himslf as he gave me last       night; names, facts, everything mentioned without ceremony. If it be not       so, let Mr Darcy contradict it. Besides, there was truth in his looks.""","""It is difficult indeed—it is distressing. One does not know what to       think.""",B-OTHER,Chapter 17
523,"""It is difficult indeed—it is distressing. One does not know what to       think.""","""I beg your pardon; one knows exactly what to think.""",B-OTHER,Chapter 17
524,"""While I can have my mornings to myself,""","""it is enough—I       think it is no sacrifice to join occasionally in evening engagements.       Society has claimson us all; and I profess myself one of those who       consider intervals of recreation and amusement as desirable for       everybody.""",B-START,Chapter 17
525,"""it is enough—I       think it is no sacrifice to join occasionally in evening engagements.       Society has claimson us all; and I profess myself one of those who       consider intervals of recreation and amusement as desirable for       everybody.""","""I am by no means of the opinion, I assure you,""",I-START,Chapter 17
526,"""I am by no means of the opinion, I assure you,""","""that a ball of       this kind, given by a young man of character, to respectable people, can       have any evil tendency; and I am so far from objecting to dancing myself,       that I shall hope to be honoured with the hands of all my fair cousins in       the course of the evening; and I take this opportunity of soliciting       yours, MissElizabeth, for the two first dances especially, a preference       which I trust my cousin Jane will attribute to the right cause, and not to       any disrespect for her.""",B-OTHER,Chapter 17
527,"""that a ball of       this kind, given by a young man of character, to respectable people, can       have any evil tendency; and I am so far from objecting to dancing myself,       that I shall hope to be honoured with the hands of all my fair cousins in       the course of the evening; and I take this opportunity of soliciting       yours, MissElizabeth, for the two first dances especially, a preference       which I trust my cousin Jane will attribute to the right cause, and not to       any disrespect for her.""","""I do not imagine his business would have called       him away just now, if he had not wanted to avoid a certain gentleman       here.""",I-OTHER,Chapter 17
528,"""I dare say you will find him very agreeable.""","""Heaven forbid! That would be the greatest misfortune of all! To       find a man agreeable whom one is determined to hate! Do not wish me such       an evil.""",B-START,Chapter 18
529,"""Heaven forbid! That would be the greatest misfortune of all! To       find a man agreeable whom one is determined to hate! Do not wish me such       an evil.""","""It is your       turn to say something now, Mr Darcy. I talked about the dance, and you       ought to make some sort of remark on the size of the room, or the number       of couples.""",B-OTHER,Chapter 18
530,"""It is your       turn to say something now, Mr Darcy. I talked about the dance, and you       ought to make some sort of remark on the size of the room, or the number       of couples.""","""Very well. That reply will do for the present. Perhaps by and by I may       observe that private balls are much pleasanter than public ones. But now       we may be silent.""",I-OTHER,Chapter 18
531,"""Very well. That reply will do for the present. Perhaps by and by I may       observe that private balls are much pleasanter than public ones. But now       we may be silent.""","""Do you talk by rule, then, while you are dancing?""",B-OTHER,Chapter 18
532,"""Do you talk by rule, then, while you are dancing?""","""Sometimes. One must speak a little, you know. It would look odd to be       entirely silent for half an hour together; and yet for the advantage of some,       conversation ought to be so arranged, as that they may have the trouble of       saying as little as possible.""",B-OTHER,Chapter 18
533,"""Sometimes. One must speak a little, you know. It would look odd to be       entirely silent for half an hour together; and yet for the advantage of some,       conversation ought to be so arranged, as that they may have the trouble of       saying as little as possible.""","""Are you consulting your own feelings in the present case, or do you       imagine that you are gratifying mine?""",B-OTHER,Chapter 18
534,"""Are you consulting your own feelings in the present case, or do you       imagine that you are gratifying mine?""","""Both,""",B-OTHER,Chapter 18
535,"""Both,""","""for I have always seen a great       similarity in the turn of our minds. We are each of an unsocial, taciturn       disposition, unwilling to speak, unless we expect to say something that       will amaze the whole room, and be handed down to posterity with all the       eclat of a proverb.""",B-OTHER,Chapter 18
536,"""for I have always seen a great       similarity in the turn of our minds. We are each of an unsocial, taciturn       disposition, unwilling to speak, unless we expect to say something that       will amaze the whole room, and be handed down to posterity with all the       eclat of a proverb.""","""This is no very striking resemblance of your own character, I am sure,""",I-OTHER,Chapter 18
537,"""This is no very striking resemblance of your own character, I am sure,""","""How near it may be to mine, I cannot pretend to say. You       think it a faithful portrait undoubtedly.""",B-OTHER,Chapter 18
538,"""How near it may be to mine, I cannot pretend to say. You       think it a faithful portrait undoubtedly.""","""I must not decide on my own performance.""",I-OTHER,Chapter 18
539,"""I must not decide on my own performance.""","""When you met us there the other day, we had just been       forming a new acquaintance.""",B-OTHER,Chapter 18
540,"""When you met us there the other day, we had just been       forming a new acquaintance.""","""Mr Wickham is blessed with such happy manners       as may ensure his making friends—whether he may be equally       capable of retaining them, is less certain.""",I-OTHER,Chapter 18
541,"""Mr Wickham is blessed with such happy manners       as may ensure his making friends—whether he may be equally       capable of retaining them, is less certain.""","""He has been so unlucky as to lose your friendship,""",I-OTHER,Chapter 18
542,"""He has been so unlucky as to lose your friendship,""","""and in a manner which he is likely to suffer       from all his life.""",B-OTHER,Chapter 18
543,"""and in a manner which he is likely to suffer       from all his life.""","""I have been most highly gratified indeed, my dear sir. Such very superior       dancing is not often seen. It is evident that you belong to the first       circles. Allow me to say, however, that your fair partner does not       disgrace you, and that I must hope to have this pleasure often repeated,       especially when a certain desirable event, my dear Eliza (glancing at her       sister and Bingley) shall take place. What congratulations will then flow       in! I appeal to Mr Darcy:—but let me not interrupt you, sir. You       will not thank me for detaining you from the bewitching converse of that       young lady, whose bright eyes are also upbraiding me.""",I-OTHER,Chapter 18
544,"""I have been most highly gratified indeed, my dear sir. Such very superior       dancing is not often seen. It is evident that you belong to the first       circles. Allow me to say, however, that your fair partner does not       disgrace you, and that I must hope to have this pleasure often repeated,       especially when a certain desirable event, my dear Eliza (glancing at her       sister and Bingley) shall take place. What congratulations will then flow       in! I appeal to Mr Darcy:—but let me not interrupt you, sir. You       will not thank me for detaining you from the bewitching converse of that       young lady, whose bright eyes are also upbraiding me.""","""Sir William's interruption has made me       forget what we were talking of.""",B-OTHER,Chapter 18
545,"""Sir William's interruption has made me       forget what we were talking of.""","""I do not think we were speaking at all. Sir William could not have       interrupted two people in the room who had less to say for themslves. We       have tried two or three subjects already without success, and what we are       to talk of next I cannot imagine.""",I-OTHER,Chapter 18
546,"""I do not think we were speaking at all. Sir William could not have       interrupted two people in the room who had less to say for themslves. We       have tried two or three subjects already without success, and what we are       to talk of next I cannot imagine.""","""What think you of books?""",B-OTHER,Chapter 18
547,"""What think you of books?""","""Books—oh! no. I am sure we never read the same, or not with the       same feelings.""",B-OTHER,Chapter 18
548,"""Books—oh! no. I am sure we never read the same, or not with the       same feelings.""","""I am sorry you think so; but if that be the case, there can at least be       no want of subject. We may compare our different opinions.""",B-OTHER,Chapter 18
549,"""I am sorry you think so; but if that be the case, there can at least be       no want of subject. We may compare our different opinions.""","""No—I cannot talk of books in a ball-room; my head is always full of       something else.""",B-OTHER,Chapter 18
550,"""No—I cannot talk of books in a ball-room; my head is always full of       something else.""","""The present always occupies you in such scenes—does it?""",B-OTHER,Chapter 18
551,"""The present always occupies you in such scenes—does it?""","""Yes, always,""",B-OTHER,Chapter 18
552,"""Yes, always,""","""I remember hearing you once say, Mr Darcy, that       you hardly ever forgave, that your resentment once created was       unappeasable. You are very cautious, I suppose, as to its being created.""",B-OTHER,Chapter 18
553,"""I remember hearing you once say, Mr Darcy, that       you hardly ever forgave, that your resentment once created was       unappeasable. You are very cautious, I suppose, as to its being created.""","""I am,""",I-OTHER,Chapter 18
554,"""I am,""","""And never allow yourself to be blinded by prejudice?""",B-OTHER,Chapter 18
555,"""And never allow yourself to be blinded by prejudice?""","""I hope not.""",B-OTHER,Chapter 18
556,"""I hope not.""","""It is particularly incumbent on those who never change their opinion, to       be secure of judging properly at first.""",B-OTHER,Chapter 18
557,"""It is particularly incumbent on those who never change their opinion, to       be secure of judging properly at first.""","""May I ask to what these questions tend?""",B-OTHER,Chapter 18
558,"""May I ask to what these questions tend?""","""Merely to the illustration of your character,""",B-OTHER,Chapter 18
559,"""Merely to the illustration of your character,""","""I am trying to make it out.""",B-OTHER,Chapter 18
560,"""I am trying to make it out.""","""And what is your success?""",I-OTHER,Chapter 18
561,"""And what is your success?""","""I do not get on at all. I hear such different       accounts of you as puzzle me exceedingly.""",B-OTHER,Chapter 18
562,"""I do not get on at all. I hear such different       accounts of you as puzzle me exceedingly.""","""I can readily believe,""",I-OTHER,Chapter 18
563,"""I can readily believe,""","""that reports may vary       greatly with respect to me; and I could wish, MissBennet, that you were       not to sketch my character at the present moment, as there is reason to       fear that the performance would reflect no credit on either.""",B-OTHER,Chapter 18
564,"""that reports may vary       greatly with respect to me; and I could wish, MissBennet, that you were       not to sketch my character at the present moment, as there is reason to       fear that the performance would reflect no credit on either.""","""But if I do not take your likeness now, I may never have another       opportunity.""",I-OTHER,Chapter 18
565,"""But if I do not take your likeness now, I may never have another       opportunity.""","""I would by no means suspend any pleasure of yours,""",B-OTHER,Chapter 18
566,"""I would by no means suspend any pleasure of yours,""","""So, MissEliza, I hear you are quite delighted with George Wickham! Your       sister has been talking to me about him, and asking me a thousand       questions; and I find that the young man quite forgot to tell you, among       his other communication, that he was the son of old Wickham, the late Mr       Darcy's steward. Let me recommend you, however, as a friend, not to give       implicit confidence to all his assertions; for as to Mr Darcy's using him       ill, it is perfectly false; for, on the contrary, he has always been       remarkably kind to him, though George Wickham has treated Mr Darcy in a       most infamous manner. I do not know the particulars, but I know very well       that Mr Darcy is not in the least to blame, that he cannot bear to hear       George Wickham mentioned, and that though my brother thought that he could       not well avoid including him in his invitation to the officers, he was       excessively glad to find that he had taken himslf out of the way. His       coming into the country at all is a most insolent thing, indeed, and I       wonder how he could presume to do it. I pity you, MissEliza, for this       discovery of your favourite's guilt; but really, considering his descent,       one could not expect much better.""",B-OTHER,Chapter 18
567,"""So, MissEliza, I hear you are quite delighted with George Wickham! Your       sister has been talking to me about him, and asking me a thousand       questions; and I find that the young man quite forgot to tell you, among       his other communication, that he was the son of old Wickham, the late Mr       Darcy's steward. Let me recommend you, however, as a friend, not to give       implicit confidence to all his assertions; for as to Mr Darcy's using him       ill, it is perfectly false; for, on the contrary, he has always been       remarkably kind to him, though George Wickham has treated Mr Darcy in a       most infamous manner. I do not know the particulars, but I know very well       that Mr Darcy is not in the least to blame, that he cannot bear to hear       George Wickham mentioned, and that though my brother thought that he could       not well avoid including him in his invitation to the officers, he was       excessively glad to find that he had taken himslf out of the way. His       coming into the country at all is a most insolent thing, indeed, and I       wonder how he could presume to do it. I pity you, MissEliza, for this       discovery of your favourite's guilt; but really, considering his descent,       one could not expect much better.""","""His guilt and his descent appear by your account to be the same,""",B-OTHER,Chapter 18
568,"""His guilt and his descent appear by your account to be the same,""","""for I have heard you accuse him of nothing worse than       of being the son of Mr Darcy's steward, and of that, I can assure       you, he informed me himslf.""",B-OTHER,Chapter 18
569,"""for I have heard you accuse him of nothing worse than       of being the son of Mr Darcy's steward, and of that, I can assure       you, he informed me himslf.""","""I beg your pardon,""",I-OTHER,Chapter 18
570,"""I beg your pardon,""","""Excuse my interference—it was kindly meant.""",B-OTHER,Chapter 18
571,"""Excuse my interference—it was kindly meant.""","""Insolent girl!""",I-OTHER,Chapter 18
572,"""Insolent girl!""","""You are much mistaken if you       expect to influence me by such a paltry attack as this. I see nothing in       it but your own wilful ignorance and the malice of Mr Darcy.""",B-OTHER,Chapter 18
573,"""You are much mistaken if you       expect to influence me by such a paltry attack as this. I see nothing in       it but your own wilful ignorance and the malice of Mr Darcy.""","""I want to know,""",I-OTHER,Chapter 18
574,"""I want to know,""","""what you have learnt about Mr Wickham. But perhaps you have       been too pleasantly engaged to think of any third person; in which case       you may be sure of my pardon.""",B-OTHER,Chapter 18
575,"""what you have learnt about Mr Wickham. But perhaps you have       been too pleasantly engaged to think of any third person; in which case       you may be sure of my pardon.""","""No,""",I-OTHER,Chapter 18
576,"""No,""","""I have not forgotten him; but I have nothing       satisfactory to tell you. Mr Bingley does not know the whole of his       history, and is quite ignorant of the circumsances which have principally       offended Mr Darcy; but he will vouch for the good conduct, the probity,       and honour of his friend, and is perfectly convinced that Mr Wickham has       deserved much less attention from Mr Darcy than he has received; and I am       sorry to say by his account as well as his sister's, Mr Wickham is by no       means a respectable young man. I am afraid he has been very imprudent, and       has deserved to lose Mr Darcy's regard.""",B-OTHER,Chapter 18
