,utter_1,utter_2,label,chapter_tag
0,"""My dear Mr Bennet,""","""have you heard that       Netherfield Park is let at last?""",B-START,Chapter 1
1,"""have you heard that       Netherfield Park is let at last?""","""But it is,""",I-START,Chapter 1
2,"""But it is,""","""for Mrs Long has just been here, and she told       me all about it.""",B-OTHER,Chapter 1
3,"""for Mrs Long has just been here, and she told       me all about it.""","""Do you not want to know who has taken it?""",I-OTHER,Chapter 1
4,"""Do you not want to know who has taken it?""","""You want to tell me, and I have no objection to hearing it.""",B-OTHER,Chapter 1
5,"""You want to tell me, and I have no objection to hearing it.""","""Why, my dear, you must know, Mrs Long says that Netherfield is taken by       a young man of large fortune from the north of England; that he came down       on Monday in a chaise and four to see the place, and was so much delighted       with it, that he agreed with Mr Morris immediately; that he is to take       possession before Michaelmas, and some of his servants are to be in the       house by the end of next week.""",B-OTHER,Chapter 1
6,"""Why, my dear, you must know, Mrs Long says that Netherfield is taken by       a young man of large fortune from the north of England; that he came down       on Monday in a chaise and four to see the place, and was so much delighted       with it, that he agreed with Mr Morris immediately; that he is to take       possession before Michaelmas, and some of his servants are to be in the       house by the end of next week.""","""What is his name?""",B-OTHER,Chapter 1
7,"""What is his name?""","""Bingley.""",B-OTHER,Chapter 1
8,"""Bingley.""","""Is he married or single?""",B-OTHER,Chapter 1
9,"""Is he married or single?""","""Oh! Single, my dear, to be sure! A single man of large fortune; four or       five thousand a year. What a fine thing for our girls!""",B-OTHER,Chapter 1
10,"""Oh! Single, my dear, to be sure! A single man of large fortune; four or       five thousand a year. What a fine thing for our girls!""","""How so? How can it affect them?""",B-OTHER,Chapter 1
11,"""How so? How can it affect them?""","""My dear Mr Bennet,""",B-OTHER,Chapter 1
12,"""My dear Mr Bennet,""","""how can you be so tiresome! You       must know that I am thinking of his marrying one of them.""",B-OTHER,Chapter 1
13,"""how can you be so tiresome! You       must know that I am thinking of his marrying one of them.""","""Is that his design in settling here?""",I-OTHER,Chapter 1
14,"""Is that his design in settling here?""","""Design! Nonsense, how can you talk so! But it is very likely that he may       fall in love with one of them, and therefore you must visit him as soon as       he comes.""",B-OTHER,Chapter 1
15,"""Design! Nonsense, how can you talk so! But it is very likely that he may       fall in love with one of them, and therefore you must visit him as soon as       he comes.""","""I see no occasion for that. You and the girls may go, or you may send       them by themslves, which perhaps will be still better, for as you are as       handsome as any of them, Mr Bingley may like you the best of the party.""",B-OTHER,Chapter 1
16,"""I see no occasion for that. You and the girls may go, or you may send       them by themslves, which perhaps will be still better, for as you are as       handsome as any of them, Mr Bingley may like you the best of the party.""","""My dear, you flatter me. I certainly have had my share of beauty,       but I do not pretend to be anything extraordinary now. When a woman has       five grown-up daughters, she ought to give over thinking of her own       beauty.""",B-OTHER,Chapter 1
17,"""My dear, you flatter me. I certainly have had my share of beauty,       but I do not pretend to be anything extraordinary now. When a woman has       five grown-up daughters, she ought to give over thinking of her own       beauty.""","""In such cases, a woman has not often much beauty to think of.""",B-OTHER,Chapter 1
18,"""In such cases, a woman has not often much beauty to think of.""","""But, my dear, you must indeed go and see Mr Bingley when he comes into       the neighbourhood.""",B-OTHER,Chapter 1
19,"""But, my dear, you must indeed go and see Mr Bingley when he comes into       the neighbourhood.""","""It is more than I engage for, I assure you.""",B-OTHER,Chapter 1
20,"""It is more than I engage for, I assure you.""","""But consider your daughters. Only think what an establishment it would be       for one of them. Sir William and Lady Lucas are determined to go, merely       on that account, for in general, you know, they visit no newcomers. Indeed       you must go, for it will be impossible for us to visit him if you       do not.""",B-OTHER,Chapter 1
21,"""But consider your daughters. Only think what an establishment it would be       for one of them. Sir William and Lady Lucas are determined to go, merely       on that account, for in general, you know, they visit no newcomers. Indeed       you must go, for it will be impossible for us to visit him if you       do not.""","""You are over-scrupulous, surely. I dare say Mr Bingley will be very glad       to see you; and I will send a few lines by you to assure him of my hearty       consent to his marrying whichever he chooses of the girls; though I must       throw in a good word for my little Lizzy.""",B-OTHER,Chapter 1
22,"""You are over-scrupulous, surely. I dare say Mr Bingley will be very glad       to see you; and I will send a few lines by you to assure him of my hearty       consent to his marrying whichever he chooses of the girls; though I must       throw in a good word for my little Lizzy.""","""I desire you will do no such thing. Lizzy is not a bit better than the       others; and I am sure she is not half so handsome as Jane, nor half so       good-humoured as Lydia. But you are always giving her the       preference.""",B-OTHER,Chapter 1
23,"""I desire you will do no such thing. Lizzy is not a bit better than the       others; and I am sure she is not half so handsome as Jane, nor half so       good-humoured as Lydia. But you are always giving her the       preference.""","""They have none of them much to recommend them,""",B-OTHER,Chapter 1
24,"""They have none of them much to recommend them,""","""they are all       silly and ignorant like other girls; but Lizzy has something more of       quickness than her sisters.""",B-OTHER,Chapter 1
25,"""they are all       silly and ignorant like other girls; but Lizzy has something more of       quickness than her sisters.""","""Mr Bennet, how can you abuse your own children in such a way? You       take delight in vexing me. You have no compassion for my poor nerves.""",I-OTHER,Chapter 1
26,"""Mr Bennet, how can you abuse your own children in such a way? You       take delight in vexing me. You have no compassion for my poor nerves.""","""You mistake me, my dear. I have a high respect for your nerves. They are       my old friends. I have heard you mention them with consideration these       last twenty years at least.""",B-OTHER,Chapter 1
27,"""You mistake me, my dear. I have a high respect for your nerves. They are       my old friends. I have heard you mention them with consideration these       last twenty years at least.""","""Ah, you do not know what I suffer.""",B-OTHER,Chapter 1
28,"""Ah, you do not know what I suffer.""","""But I hope you will get over it, and live to see many young men of four       thousand a year come into the neighbourhood.""",B-OTHER,Chapter 1
29,"""But I hope you will get over it, and live to see many young men of four       thousand a year come into the neighbourhood.""","""It will be no use to us, if twenty such should come, since you will not       visit them.""",B-OTHER,Chapter 1
30,"""It will be no use to us, if twenty such should come, since you will not       visit them.""","""Depend upon it, my dear, that when there are twenty, I will visit them       all.""",B-OTHER,Chapter 1
31,"""I hope Mr Bingley will like it, Lizzy.""","""We are not in a way to know what Mr Bingley likes,""",B-START,Chapter 2
32,"""We are not in a way to know what Mr Bingley likes,""","""since we are not to visit.""",B-OTHER,Chapter 2
33,"""since we are not to visit.""","""But you forget, mamma,""",I-OTHER,Chapter 2
34,"""But you forget, mamma,""","""that we shall meet him at the       assemblies, and that Mrs Long promised to introduce him.""",B-OTHER,Chapter 2
35,"""that we shall meet him at the       assemblies, and that Mrs Long promised to introduce him.""","""I do not believe Mrs Long will do any such thing. She has two nieces of       her own. She is a selfish, hypocritical woman, and I have no opinion of       her.""",I-OTHER,Chapter 2
36,"""I do not believe Mrs Long will do any such thing. She has two nieces of       her own. She is a selfish, hypocritical woman, and I have no opinion of       her.""","""No more have I,""",B-OTHER,Chapter 2
37,"""No more have I,""","""and I am glad to find that you do not       depend on her serving you.""",B-OTHER,Chapter 2
38,"""and I am glad to find that you do not       depend on her serving you.""","""Don't keep coughing so, Kitty, for Heaven's sake! Have a little       compassion on my nerves. You tear them to pieces.""",I-OTHER,Chapter 2
39,"""Don't keep coughing so, Kitty, for Heaven's sake! Have a little       compassion on my nerves. You tear them to pieces.""","""Kitty has no discretion in her coughs,""",B-OTHER,Chapter 2
40,"""Kitty has no discretion in her coughs,""","""she times them       ill.""",B-OTHER,Chapter 2
41,"""she times them       ill.""","""I do not cough for my own amusement,""",I-OTHER,Chapter 2
42,"""I do not cough for my own amusement,""","""When is       your next ball to be, Lizzy?""",B-OTHER,Chapter 2
43,"""When is       your next ball to be, Lizzy?""","""To-morrow fortnight.""",I-OTHER,Chapter 2
44,"""To-morrow fortnight.""","""Aye, so it is,""",B-OTHER,Chapter 2
45,"""Aye, so it is,""","""and Mrs Long does not come back till       the day before; so it will be impossible for her to introduce him, for she       will not know him herself.""",B-OTHER,Chapter 2
46,"""and Mrs Long does not come back till       the day before; so it will be impossible for her to introduce him, for she       will not know him herself.""","""Then, my dear, you may have the advantage of your friend, and introduce       Mr Bingley to her.""",I-OTHER,Chapter 2
47,"""Then, my dear, you may have the advantage of your friend, and introduce       Mr Bingley to her.""","""Impossible, Mr Bennet, impossible, when I am not acquainted with him       myself; how can you be so teasing?""",B-OTHER,Chapter 2
48,"""Impossible, Mr Bennet, impossible, when I am not acquainted with him       myself; how can you be so teasing?""","""I honour your circumsection. A fortnight's acquaintance is certainly       very little. One cannot know what a man really is by the end of a       fortnight. But if we do not venture somebody else will; and after       all, Mrs Long and her nieces must stand their chance; and, therefore,       as she will think it an act of kindness, if you decline the office, I will       take it on myself.""",B-OTHER,Chapter 2
49,"""I honour your circumsection. A fortnight's acquaintance is certainly       very little. One cannot know what a man really is by the end of a       fortnight. But if we do not venture somebody else will; and after       all, Mrs Long and her nieces must stand their chance; and, therefore,       as she will think it an act of kindness, if you decline the office, I will       take it on myself.""","""Nonsense,       nonsense!""",B-OTHER,Chapter 2
50,"""Nonsense,       nonsense!""","""What can be the meaning of that emphatic exclamation?""",I-OTHER,Chapter 2
51,"""What can be the meaning of that emphatic exclamation?""","""Do you       consider the formsof introduction, and the stress that is laid on them,       as nonsense? I cannot quite agree with you there. What say you,       Mary? For you are a young lady of deep reflection, I know, and read great       books and make extracts.""",B-OTHER,Chapter 2
52,"""Do you       consider the formsof introduction, and the stress that is laid on them,       as nonsense? I cannot quite agree with you there. What say you,       Mary? For you are a young lady of deep reflection, I know, and read great       books and make extracts.""","""While Mary is adjusting her ideas,""",I-OTHER,Chapter 2
53,"""While Mary is adjusting her ideas,""","""let us return to Mr       Bingley.""",B-OTHER,Chapter 2
54,"""let us return to Mr       Bingley.""","""I am sick of Mr Bingley,""",I-OTHER,Chapter 2
55,"""I am sick of Mr Bingley,""","""I am sorry to hear that; but why did not you tell me that before?       If I had known as much this morning I certainly would not have called on       him. It is very unlucky; but as I have actually paid the visit, we cannot       escape the acquaintance now.""",B-OTHER,Chapter 2
56,"""I am sorry to hear that; but why did not you tell me that before?       If I had known as much this morning I certainly would not have called on       him. It is very unlucky; but as I have actually paid the visit, we cannot       escape the acquaintance now.""","""How good it was in you, my dear Mr Bennet! But I knew I should persuade       you at last. I was sure you loved your girls too well to neglect such an       acquaintance. Well, how pleased I am! and it is such a good joke, too,       that you should have gone this morning and never said a word about it till       now.""",B-OTHER,Chapter 2
57,"""How good it was in you, my dear Mr Bennet! But I knew I should persuade       you at last. I was sure you loved your girls too well to neglect such an       acquaintance. Well, how pleased I am! and it is such a good joke, too,       that you should have gone this morning and never said a word about it till       now.""","""Now, Kitty, you may cough as much as you choose,""",B-OTHER,Chapter 2
58,"""Now, Kitty, you may cough as much as you choose,""","""What an excellent father you have, girls!""",B-OTHER,Chapter 2
59,"""What an excellent father you have, girls!""","""I do not know how you will ever make him amends for his kindness;       or me, either, for that matter. At our time of life it is not so pleasant,       I can tell you, to be making new acquaintances every day; but for your       sakes, we would do anything. Lydia, my love, though you are the       youngest, I dare say Mr Bingley will dance with you at the next ball.""",B-OTHER,Chapter 2
60,"""I do not know how you will ever make him amends for his kindness;       or me, either, for that matter. At our time of life it is not so pleasant,       I can tell you, to be making new acquaintances every day; but for your       sakes, we would do anything. Lydia, my love, though you are the       youngest, I dare say Mr Bingley will dance with you at the next ball.""","""Oh!""",I-OTHER,Chapter 2
61,"""Oh!""","""I am not afraid; for though I am the       youngest, I'm the tallest.""",B-OTHER,Chapter 2
62,"""If I can but see one of my daughters happily settled at Netherfield,""","""and all the others equally well married,       I shall have nothing to wish for.""",B-START,Chapter 3
63,"""Come, Darcy,""","""I must have you dance. I hate to see you standing       about by yourself in this stupid manner. You had much better dance.""",B-START,Chapter 3
64,"""I must have you dance. I hate to see you standing       about by yourself in this stupid manner. You had much better dance.""","""I certainly shall not. You know how I detest it, unless I am particularly       acquainted with my partner. At such an assembly as this it would be       insupportable. Your sisters are engaged, and there is not another woman in       the room whom it would not be a punishment to me to stand up with.""",I-START,Chapter 3
65,"""I certainly shall not. You know how I detest it, unless I am particularly       acquainted with my partner. At such an assembly as this it would be       insupportable. Your sisters are engaged, and there is not another woman in       the room whom it would not be a punishment to me to stand up with.""","""I would not be so fastidious as you are,""",B-OTHER,Chapter 3
66,"""I would not be so fastidious as you are,""","""for a       kingdom! Upon my honour, I never met with so many pleasant girls in my       life as I have this evening; and there are several of them you see       uncommonly pretty.""",B-OTHER,Chapter 3
67,"""for a       kingdom! Upon my honour, I never met with so many pleasant girls in my       life as I have this evening; and there are several of them you see       uncommonly pretty.""","""You are dancing with the only handsome girl in the room,""",I-OTHER,Chapter 3
68,"""You are dancing with the only handsome girl in the room,""","""Oh! She is the most beautiful creature I ever beheld! But there is one of       her sisters sitting down just behind you, who is very pretty, and I dare       say very agreeable. Do let me ask my partner to introduce you.""",B-OTHER,Chapter 3
69,"""Oh! She is the most beautiful creature I ever beheld! But there is one of       her sisters sitting down just behind you, who is very pretty, and I dare       say very agreeable. Do let me ask my partner to introduce you.""","""Which do you mean?""",B-OTHER,Chapter 3
70,"""Which do you mean?""","""She is tolerable, but not handsome enough to tempt me; I am in no       humour at present to give consequence to young ladies who are slighted by       other men. You had better return to your partner and enjoy her smiles, for       you are wasting your time with me.""",B-OTHER,Chapter 3
71,"""She is tolerable, but not handsome enough to tempt me; I am in no       humour at present to give consequence to young ladies who are slighted by       other men. You had better return to your partner and enjoy her smiles, for       you are wasting your time with me.""","""Oh! my dear Mr Bennet,""",I-OTHER,Chapter 3
72,"""Oh! my dear Mr Bennet,""","""we have had a most       delightful evening, a most excellent ball. I wish you had been there. Jane       was so admired, nothing could be like it. Everybody said how well she       looked; and Mr Bingley thought her quite beautiful, and danced with her       twice! Only think of that, my dear; he actually danced with her       twice! and she was the only creature in the room that he asked a second       time. First of all, he asked MissLucas. I was so vexed to see him stand       up with her! But, however, he did not admire her at all; indeed, nobody       can, you know; and he seemed quite struck with Jane as she was going down       the dance. So he inquired who she was, and got introduced, and asked her       for the two next. Then the two third he danced with MissKing, and the two       fourth with Maria Lucas, and the two fifth with Jane again, and the two       sixth with Lizzy, and the Boulanger—""",B-OTHER,Chapter 3
73,"""we have had a most       delightful evening, a most excellent ball. I wish you had been there. Jane       was so admired, nothing could be like it. Everybody said how well she       looked; and Mr Bingley thought her quite beautiful, and danced with her       twice! Only think of that, my dear; he actually danced with her       twice! and she was the only creature in the room that he asked a second       time. First of all, he asked MissLucas. I was so vexed to see him stand       up with her! But, however, he did not admire her at all; indeed, nobody       can, you know; and he seemed quite struck with Jane as she was going down       the dance. So he inquired who she was, and got introduced, and asked her       for the two next. Then the two third he danced with MissKing, and the two       fourth with Maria Lucas, and the two fifth with Jane again, and the two       sixth with Lizzy, and the Boulanger—""","""If he had had any compassion for me,""",I-OTHER,Chapter 3
74,"""If he had had any compassion for me,""","""he would not have danced half so much! For God's sake, say       no more of his partners. Oh that he had sprained his ankle in the first       dance!""",B-OTHER,Chapter 3
75,"""he would not have danced half so much! For God's sake, say       no more of his partners. Oh that he had sprained his ankle in the first       dance!""","""Oh! my dear, I am quite delighted with him. He is so excessively       handsome! And his sisters are charming women. I never in my life saw       anything more elegant than their dresses. I dare say the lace upon Mrs       Hurst's gown—""",I-OTHER,Chapter 3
76,"""Oh! my dear, I am quite delighted with him. He is so excessively       handsome! And his sisters are charming women. I never in my life saw       anything more elegant than their dresses. I dare say the lace upon Mrs       Hurst's gown—""","""But I can assure you,""",B-OTHER,Chapter 3
77,"""But I can assure you,""","""that Lizzy does not lose much by not       suiting his fancy; for he is a most disagreeable, horrid man, not       at all worth pleasing. So high and so conceited that there was no enduring       him! He walked here, and he walked there, fancying himslf so very great!       Not handsome enough to dance with! I wish you had been there, my dear, to       have given him one of your set-downs. I quite detest the man.""",B-OTHER,Chapter 3
78,"""He is just what a young man ought to be,""","""sensible,       good-humoured, lively; and I never saw such happy manners!—so much       ease, with such perfect good breeding!""",B-START,Chapter 4
79,"""sensible,       good-humoured, lively; and I never saw such happy manners!—so much       ease, with such perfect good breeding!""","""He is also handsome,""",I-START,Chapter 4
80,"""He is also handsome,""","""which a young man ought       likewise to be, if he possibly can. His character is thereby complete.""",B-OTHER,Chapter 4
81,"""which a young man ought       likewise to be, if he possibly can. His character is thereby complete.""","""I was very much flattered by his asking me to dance a second time. I did       not expect such a compliment.""",I-OTHER,Chapter 4
82,"""I was very much flattered by his asking me to dance a second time. I did       not expect such a compliment.""","""Did not you? I did for you. But that is one great difference between us.       Compliments always take you by surprise, and me never. What       could be more natural than his asking you again? He could not help seeing       that you were about five times as pretty as every other woman in the room.       No thanks to his gallantry for that. Well, he certainly is very agreeable,       and I give you leave to like him. You have liked many a stupider person.""",B-OTHER,Chapter 4
83,"""Did not you? I did for you. But that is one great difference between us.       Compliments always take you by surprise, and me never. What       could be more natural than his asking you again? He could not help seeing       that you were about five times as pretty as every other woman in the room.       No thanks to his gallantry for that. Well, he certainly is very agreeable,       and I give you leave to like him. You have liked many a stupider person.""","""Dear Lizzy!""",B-OTHER,Chapter 4
84,"""Dear Lizzy!""","""Oh! you are a great deal too apt, you know, to like people in general.       You never see a fault in anybody. All the world are good and agreeable in       your eyes. I never heard you speak ill of a human being in your life.""",B-OTHER,Chapter 4
85,"""Oh! you are a great deal too apt, you know, to like people in general.       You never see a fault in anybody. All the world are good and agreeable in       your eyes. I never heard you speak ill of a human being in your life.""","""I would not wish to be hasty in censuring anyone; but I always speak what       I think.""",B-OTHER,Chapter 4
86,"""I would not wish to be hasty in censuring anyone; but I always speak what       I think.""","""I know you do; and it is that which makes the wonder. With your       good sense, to be so honestly blind to the follies and nonsense of others!       Affectation of candour is common enough—one meets with it       everywhere. But to be candid without ostentation or design—to take       the good of everybody's character and make it still better, and say       nothing of the bad—belongs to you alone. And so you like this man's       sisters, too, do you? Their manners are not equal to his.""",B-OTHER,Chapter 4
87,"""I know you do; and it is that which makes the wonder. With your       good sense, to be so honestly blind to the follies and nonsense of others!       Affectation of candour is common enough—one meets with it       everywhere. But to be candid without ostentation or design—to take       the good of everybody's character and make it still better, and say       nothing of the bad—belongs to you alone. And so you like this man's       sisters, too, do you? Their manners are not equal to his.""","""Certainly not—at first. But they are very pleasing women when you       converse with them. MissBingley is to live with her brother, and keep his       house; and I am much mistaken if we shall not find a very charming       neighbour in her.""",B-OTHER,Chapter 4
88,"""You began the evening well, Charlotte,""","""You were Mr Bingley's first       choice.""",B-START,Chapter 5
89,"""You were Mr Bingley's first       choice.""","""Yes; but he seemed to like his second better.""",I-START,Chapter 5
90,"""Yes; but he seemed to like his second better.""","""Oh! you mean Jane, I suppose, because he danced with her twice. To be       sure that did seem as if he admired her—indeed I rather       believe he did—I heard something about it—but I hardly       know what—something about Mr Robinson.""",B-OTHER,Chapter 5
